EPSS02,SALUD TOTAL,890901825.0,FUNDACIÓN CLÍNICA NOEL,8691405.0,
EPSS02,SALUD TOTAL,890901826.0,HOSPITAL PABLO TOBON URIBE,206747191.0,
EPSS02,SALUD TOTAL,890902922.0,UNIVERSIDAD PONTIFICIA BOLIVARIANA,266186615.0,
EPSS02,SALUD TOTAL,890903777.0,SOCIEDAD MEDICA ANTIOQUEÑA S.A. SOMA,87533246.0,
EPSS02,SALUD TOTAL,890904646.0,"HOSPITAL GENERAL DE MEDELLIN LUZ CASTRO DE GUTIERREZ, EMPRESA SOCIAL DEL ESTADO",214541065.0,
EPSS02,SALUD TOTAL,890905097.0,E.S.E. HOSPITAL FRANCISCO ELADIO BARRERA,4612743.0,
EPSS02,SALUD TOTAL,890905166.0,"E.S.E. HOSPITAL MENTAL DE ANTIOQUIA ""MARÍA UPEGUI - HOMO""",36510715.0,
EPSS02,SALUD TOTAL,890905177.0,E.S.E. HOSPITAL LA MARIA,92503595.0,
EPSS02,SALUD TOTAL,890905193.0,ESE HOSPITAL SAN VICENTE DE PAUL,5025010.0,
EPSS02,SALUD TOTAL,890905198.0,EMPRESA SOCIAL DEL ESTADO HOSPITAL SANTAMARIA,1194128.0,
EPSS02,SALUD TOTAL,890905843.0,COMUNIDAD DE HERMANAS DOMINICAS DE LA PRESENTACION DE LA SANTISIMA VIRGEN DE TOURS PROVINCIA DE MEDELLIN,232959456.0,
EPSS02,SALUD TOTAL,890906346.0,ESE HOSPITAL SAN FERNANDO,5401898.0,
EPSS02,SALUD TOTAL,890906347.0,ESE HOSPITAL MANUEL URIBE ANGEL,27556556.0,
EPSS02,SALUD TOTAL,890906793.0,LABORATORIO MEDICO ECHAVARRIA SAS,51253312.0,
EPSS02,SALUD TOTAL,890907241.0,E.S.E. HOSPITAL LA MERCED DE CIUDAD BOLIVAR,13502461.0,
EPSS02,SALUD TOTAL,890907297.0,ESE HOSPITAL SAN JUAN DE DIOS,1773111.0,
EPSS02,SALUD TOTAL,890911816.0,CLINICA MEDELLIN S.A.S.,64045201.0,
EPSS02,SALUD TOTAL,890925336.0,CLINICA DE CIRUGIA AMBULATORIA CONQUISTADORES S.A.,77412232.0,
EPSS02,SALUD TOTAL,890930071.0,ESCANOGRAFÍA NEUROLÓGICA S.A,100545812.0,
EPSS02,SALUD TOTAL,890933123.0,DEPARTAMENTO DE RADIOLOGIA S.A,4169312.0,
EPSS02,SALUD TOTAL,890938774.0,CLINICA DEL PRADO S.A.S,81236986.0,
EPSS02,SALUD TOTAL,890939936.0,SOCIEDAD MEDICA RIONEGRO SA,283753414.0,
EPSS02,SALUD TOTAL,890980486.0,EMPRESA SOCIAL DEL ESTADO HOSPITAL SAN JUAN DE DIOS,3030214.0,
EPSS02,SALUD TOTAL,890980643.0,EMPRESA SOCIAL DEL ESTADO HOSPITAL SAN JUAN DE DIOS DE ABEJORRAL,2741873.0,
EPSS02,SALUD TOTAL,890980727.0,E.S.E. HOSPITAL SAN RAFAEL,4292585.0,
EPSS02,SALUD TOTAL,890980732.0,ESE HOSPITAL GABRIEL PELAEZ MONTOYA,1501494.0,
EPSS02,SALUD TOTAL,890980752.0,E.S.E. SAN JUAN DE DIOS DE MARINILLA,3724719.0,
EPSS02,SALUD TOTAL,890980757.0,ESE HOSPITAL CESAR URIBE PIEDRAHITA,43712468.0,
EPSS02,SALUD TOTAL,890980758.0,ESE HOSPITAL DE LA CEJA,6552519.0,
EPSS02,SALUD TOTAL,890980814.0,EMPRESA SOCIAL DEL ESTADO HOSPITAL SAN RAFAEL,5495188.0,
EPSS02,SALUD TOTAL,890980866.0,E.S.E. HOSPITAL SAN ROQUE - LA UNION,7779476.0,
EPSS02,SALUD TOTAL,890980949.0,ESE HOSPITAL SANTA MARGARITA,1409926.0,
EPSS02,SALUD TOTAL,890980997.0,EMPRESA SOCIAL DEL ESTADO HOSPITAL MARIA AUXILIADORA,1369696.0,
EPSS02,SALUD TOTAL,890981096.0,EMPRESA SOCIAL DEL ESTADO HOSPITAL SAN ANTONIO,1029604.0,
EPSS02,SALUD TOTAL,890981182.0,ESE HOSPITAL PADRE CLEMENTE GIRALDO,1893000.0,
EPSS02,SALUD TOTAL,890981266.0,E.S.E. HOSPITAL SAN PIO X,4346000.0,
EPSS02,SALUD TOTAL,890981268.0,EMPRESA SOCIAL DEL ESTADO HOSPITAL LA ANUNCIACION,3006417.0,
EPSS02,SALUD TOTAL,890981536.0,EMPRESA SOCIAL DEL ESTADO HOSPITAL SAN RAFAEL DE YOLOMBO,36082795.0,
EPSS02,SALUD TOTAL,890981561.0,E.S.E. HOSPITAL SAN VICENTE DE PAÚL,3017384.0,
EPSS02,SALUD TOTAL,890981719.0,E.S.E. NUETRA SEÑORA DE LA CANDELARIA,3618729.0,
EPSS02,SALUD TOTAL,890981726.0,EMPRESA SOCIAL DEL ESTADO HOSPITAL SAN JUAN DE DIOS YARUMAL,19861251.0,
EPSS02,SALUD TOTAL,890981817.0,E.S.E. HOSPITAL LA INMACULADA,2349729.0,
EPSS02,SALUD TOTAL,890982101.0,E.S.E HOSPITAL EL CARMEN,2273611.0,
EPSS02,SALUD TOTAL,890982113.0,EMPRESA SOCIAL DEL ESTADO HOSPITAL GUSTAVO GONZALEZ OCHOA,1187044.0,
EPSS02,SALUD TOTAL,890982134.0,E.S.E. HOSPITAL PEDRO NEL CARDONA,2325331.0,
EPSS02,SALUD TOTAL,890982264.0,EMPRESA SOCIAL DEL ESTADO HOSPITAL SAN JUAN DE DIOS,14049903.0,
EPSS02,SALUD TOTAL,890982608.0,CORPORACION PARA ESTUDIOS EN SALUD CLINICA CES,66551908.0,
EPSS02,SALUD TOTAL,890984670.0,EMPRESA SOCIAL DEL ESTADO HOSPITAL NUESTRA SEÑORA DEL PERPETUO SOCORRO,1473583.0,
EPSS02,SALUD TOTAL,890984779.0,ESE HOSPITAL PRESBITERO EMIGDIO PALACIO,1745358.0,
EPSS02,SALUD TOTAL,890985603.0,E.S.E. HOSPITAL SAN SEBASTIÁN DE URABÁ,2206700.0,
EPSS02,SALUD TOTAL,890985660.0,E.S.E. HOSPITAL OSCAR EMIRO VERGARA CRUZ,3742529.0,
EPSS02,SALUD TOTAL,890985703.0,E.S.E. HOSPITAL MARCO FIDEL SUAREZ,82145414.0,
EPSS02,SALUD TOTAL,890985810.0,EMPRESA SOCIAL DEL ESTADO HOSPITAL OCTAVIO OLIVARES,4079660.0,
EPSS02,SALUD TOTAL,891000499.0,E.S.E HOSPITAL SAN JOSE DE SAN BERNARDO DEL VIENTO,6830111.0,
EPSS02,SALUD TOTAL,891000736.0,E.S.E. HOSPITAL SAN NICOLAS,8552373.0,
EPSS02,SALUD TOTAL,891079999.0,ESE HOSPITAL SAN JERÓNIMO DE MONTERÍA,38905220.0,
EPSS02,SALUD TOTAL,891080015.0,EMPRESA SOCIAL DEL ESTADO HOSPITAL SANDIEGO DE CERETE,128247760.0,
EPSS02,SALUD TOTAL,891180026.0,E.S.E. HOSPITAL DEPARTAMENTAL SAN VICENTE DE PAUL DE GARZON,105496333.0,
EPSS02,SALUD TOTAL,891180098.0,HOSPITAL DEPARTAMENTAL MARIA INMACULADA ESE,53868640.0,
EPSS02,SALUD TOTAL,891180113.0,E.S.E. HOSPITAL ARSENIO REPIZO VANEGAS DE SAN AGUSTIN,1556718.0,
EPSS02,SALUD TOTAL,891180117.0,E.S.E. HOSPITAL DEPARTAMENTAL SAN ANTONIO DE PADUA DE LA PLATA,83263095.0,
EPSS02,SALUD TOTAL,891180134.0,E.S.E. HOSPITAL DEPARTAMENTAL SAN ANTONIO DE PITALITO,24974693.0,
EPSS02,SALUD TOTAL,891180190.0,ESE HOSPITAL NUESTRA SEÑORA DE FATIMA DE SUAZA,1826201.0,
EPSS02,SALUD TOTAL,891180198.0,E.S.E. HOSPITAL MUNICIPAL SAN ANTONIO DE TIMANA,1173563.0,
EPSS02,SALUD TOTAL,891180268.0,E.S.E. HOSPITAL UNIVERSITARIO HERNANDO MONCALEANO PERDOMO DE NEIVA,1653629330.0,
EPSS02,SALUD TOTAL,891200528.0,E.S.E. HOSPITAL UNIVERSITARIO DEPARTAMENTAL DE NARIÑO,22910869.0,
EPSS02,SALUD TOTAL,891200679.0,EMPRESA SOCIAL DEL ESTADO HOSPITAL JOSÉ MARÍA HERNÁNDEZ,1969233.0,
EPSS02,SALUD TOTAL,891300047.0,CLINICA PALMIRA S.A.,2303685.0,
EPSS02,SALUD TOTAL,891380054.0,FUNDACION HOSPITAL SAN JOSE DE BUGA,24256037.0,
EPSS02,SALUD TOTAL,891380055.0,EMPRESA SOCIAL DEL ESTADO HOSPITAL BENJAMIN BARNEY GASCA,7896650.0,
EPSS02,SALUD TOTAL,891380184.0,E.S.E. HOSPITAL LOCAL CANDELARIA VALLE EMPRESA SOCIAL DEL ESTADO,4297186.0,
EPSS02,SALUD TOTAL,891401308.0,EMPRESA SOCIAL DEL ESTADO HOSPITAL NAZARETH QUINCHIA,5623626.0,
EPSS02,SALUD TOTAL,891401643.0,EMPRESA SOCIAL DEL ESTADO HOSPITAL SAN PEDRO Y SAN PABLO LA VIRGINIA,96974971.0,
EPSS02,SALUD TOTAL,891401777.0,EMPRESA SOCIAL DEL ESTADO HOSPITAL SAN VICENTE DE PAUL SANTUARIO,5191182.0,
EPSS02,SALUD TOTAL,891408586.0,LIGA CONTRA EL CANCER SECCIONAL RISARALDA,168687752.0,
EPSS02,SALUD TOTAL,891408974.0,INSTITUTO DE AUDIOLOGIA INTEGRAL,2658365.0,
EPSS02,SALUD TOTAL,891409017.0,EMPRESA SOCIAL DEL ESTADO HOSPITAL SAN VICENTE DE PAUL APIA,1608182.0,
EPSS02,SALUD TOTAL,891409390.0,RADIOLOGOS ASOCIADOS S.A.S,36549453.0,
EPSS02,SALUD TOTAL,891409981.0,CLINICA LOS ROSALES S.A,1454547153.0,
EPSS02,SALUD TOTAL,891411663.0,ESE HOSPITAL SANTA MÓNICA,103899161.0,
EPSS02,SALUD TOTAL,891412126.0,ESE HOSPITAL SAN VICENTE DE PAUL.,11232630.0,
EPSS02,SALUD TOTAL,891412134.0,E.S.E. HOSPITAL MENTALUNIVERSITARIO DE RISARALDA,81535854.0,
EPSS02,SALUD TOTAL,891480000.0,CAJA DE COMPENSACION FAMILIAR DE RISARALDA COMFAMILIAR RISARALDA,17944744.0,
EPSS02,SALUD TOTAL,891480036.0,EMPRESA SOCIAL DEL ESTADO HOSPITAL SAN VICENTE DE PAUL SANTA ROSA DE CABAL,71869855.0,
EPSS02,SALUD TOTAL,891500084.0,HOSPITAL FRANCISCO DE PAULA SANTANDER E.S.E. NIVEL II,2363153.0,
EPSS02,SALUD TOTAL,891500736.0,E.S.E. HOSPITAL NIVEL I EL BORDO,1303287.0,
EPSS02,SALUD TOTAL,891501676.0,"HOSPITAL SUSANA LOPEZ DE VALENCIA, EMPRESA SOCIAL DEL ESTADO",1047433.0,
EPSS02,SALUD TOTAL,891580002.0,HOSPITAL UNIVERSITARIO SAN JOSE DE POPAYAN E.S.E.,18025555.0,
EPSS02,SALUD TOTAL,891702882.0,CENTRO DE CIRUGIA OCULAR LTDA,54780865.0,
EPSS02,SALUD TOTAL,891780008.0,E.S.E. HOSPITAL SAN RAFAEL,128884676.0,
EPSS02,SALUD TOTAL,891780185.0,EMPRESA SOCIAL DEL ESTADO HOSPITAL UNIVERSITARIO JULIO MENDEZ BARRENECHE,68902528.0,
EPSS02,SALUD TOTAL,891800231.0,EMPRESA SOCIAL DEL ESTADO HOSPITAL UNIVERSITARIO SAN RAFAEL DE TUNJA,167600216.0,
EPSS02,SALUD TOTAL,891800395.0,HOSPITAL REGIONAL DE MONIQUIRA ESE,6619788.0,
EPSS02,SALUD TOTAL,891800570.0,EMPRESA SOCIAL DEL ESTADO HOSPITAL JOSE CAYETANO VASQUEZ,37268796.0,
EPSS02,SALUD TOTAL,891800611.0,EMPRESA SOCIAL DEL ESTADO HOSPITAL SAN ANTONIO DE SOATA,3177117.0,
EPSS02,SALUD TOTAL,891855029.0,HOSPITAL REGIONAL DE LA ORINOQUIA E.S.E.,30149212.0,
EPSS02,SALUD TOTAL,891855039.0,HOSPITAL REGIONAL DE SOGAMOSO EMPRESA SOCIAL DEL ESTADO,45199868.0,
EPSS02,SALUD TOTAL,891855209.0,E.S.E. HOSPITAL SAN VICENTE DE PAUL DE PAIPA,6392970.0,
EPSS02,SALUD TOTAL,891855438.0,EMPRESA SOCIAL DEL ESTADO HOSPITAL REGIONAL DE DUITAMA,119365413.0,
EPSS02,SALUD TOTAL,891900367.0,HOSPITAL GONZALO CONTRERAS EMPRESA SOCIAL DEL ESTADO,5264220.0,
EPSS02,SALUD TOTAL,891900441.0,HOSPITAL DEPARTAMENTAL SAN RAFAEL DE ZARZAL E.S.E.,1856464.0,
EPSS02,SALUD TOTAL,891900732.0,E.S.E. HOSPITAL KENNEDY EMPRESA SOCIAL DEL ESTADO,1647243.0,
EPSS02,SALUD TOTAL,891901296.0,E.S.E. HOSPITAL SANTA LUCIA EMPRESA SOCIAL DEL ESTADO DE EL DOVIO VALLE,1082968.0,
EPSS02,SALUD TOTAL,892000264.0,E.S.E. HOSPITAL MUNICIPAL DE ACACIAS,29910344.0,
EPSS02,SALUD TOTAL,892000458.0,EMPRESA SOCIAL DEL ESTADO HOSPITAL LOCAL DE SAN MARTIN DE LOS LLANOS,4733764.0,
EPSS02,SALUD TOTAL,892000501.0,HOSPITAL DEPARTAMENTAL DE VILLAVICENCIO E.S.E.,374710569.0,
EPSS02,SALUD TOTAL,892001990.0,EMPRESA SOCIAL DEL ESTADO REGION DE SALUD MEDINA,2520507.0,
EPSS02,SALUD TOTAL,892115009.0,EMPRESA SOCIAL DEL ESTADO HOSPITAL NUESTRA SEÑORA DE LOS REMEDIOS,4786814.0,
EPSS02,SALUD TOTAL,892115010.0,EMPRESA SOCIAL DEL ESTADO HOSPITAL SAN RAFAEL NIVEL II,34994994.0,
EPSS02,SALUD TOTAL,892170002.0,ESE HOSPITAL SAN AGUSTIN DE FONSECA,4317942.0,
EPSS02,SALUD TOTAL,892201100.0,LIGA CONTRA EL CÁNCER SECCIONAL SUCRE,18429522.0,
EPSS02,SALUD TOTAL,892300175.0,HOSPITAL REGIONAL SAN ANDRES ESE,112017004.0,
EPSS02,SALUD TOTAL,892300445.0,ESE HOSPITAL REGIONAL DE AGUACHICA JOSE DAVID PADILLA VILLAFAÑE,66350451.0,
EPSS02,SALUD TOTAL,892300979.0,CLINICA DEL CESAR S.A.,185603656.0,
EPSS02,SALUD TOTAL,892399994.0,HOSPITAL ROSARIO PUMAREJO DE LOPEZ - EMPRESA SOCIAL DEL ESTADO,66707296.0,
EPSS02,SALUD TOTAL,899999032.0,EMPRESA SOCIAL DEL ESTADO HOSPITAL UNIVERSITARIO DE LA SAMARITANA,338730685.0,
EPSS02,SALUD TOTAL,899999092.0,INSTITUTO NACIONAL DE CANCEROLOGIA - EMPRESA SOCIAL DEL ESTADO,576161674.0,
EPSS02,SALUD TOTAL,899999123.0,FUNDACION HOSPITAL DE LA MISERICORDIA,581019912.0,
EPSS02,SALUD TOTAL,899999147.0,EMPRESA SOCIAL DEL ESTADO HOSPITAL EL SALVADOR DE UBATE,47711825.0,
EPSS02,SALUD TOTAL,899999151.0,E.S.E HOSPITAL SAN RAFAEL DE FACATATIVÁ,593677014.0,
EPSS02,SALUD TOTAL,899999156.0,E.S.E. HOSPITAL SAN ANTONIO CHIA,10086919.0,
EPSS02,SALUD TOTAL,899999158.0,EMPRESA SOCIAL DEL ESTADO HOSPITAL SAN ANTONIO,3378709.0,
EPSS02,SALUD TOTAL,899999164.0,ESE HOSPITAL NUESTRA SEÑORA DEL CARMEN DE TABIO,8040436.0,
EPSS02,SALUD TOTAL,899999165.0,EMPRESA SOCIAL DEL ESTADO HOSPITAL SAN JOSE,8147612.0,
EPSS02,SALUD TOTAL,900002780.0,FUNDACIÓN CAMPBELL,31842644.0,
EPSS02,SALUD TOTAL,900004059.0,HOSPITAL DE CASTILLA LA NUEVA ESE,19859826.0,
EPSS02,SALUD TOTAL,900004894.0,HOSPITAL REGIONAL SEGUNDO NIVEL DE ATENCIÓN VALLE DE TENZA E.S.E.,4005597.0,
EPSS02,SALUD TOTAL,900006037.0,EMPRESA SOCIAL DEL ESTADO HOSPITAL UNIVERSITARIO DE SANTANDER,527431361.0,
EPSS02,SALUD TOTAL,900006221.0,AMBULANCIAS AEREAS DE COLOMBIA S.A.S.,13751250.0,
EPSS02,SALUD TOTAL,900007679.0,CENTRO VISUAL MODERNO S.A.S.,717722069.0,
EPSS02,SALUD TOTAL,900007860.0,UNIDAD DE SEGUIMIENTO DEL RECIEN NACIDO Y ATENCION PEDIATRICA IPS S.A.S,3962630.0,
EPSS02,SALUD TOTAL,900007922.0,AUDIOMEDICA S.A.S.,33730123.0,
EPSS02,SALUD TOTAL,900008328.0,CLINICA INTEGRAL DE EMERGENCIAS LAURA DANIELA S.A.,191814605.0,
EPSS02,SALUD TOTAL,900009080.0,DENTISANA SAS,2876334.0,
EPSS02,SALUD TOTAL,900012819.0,DIAC S.A.S,76569945.0,
EPSS02,SALUD TOTAL,900013381.0,SOCIEDAD MEDICA DE ESPECIALISTAS DIAGNOSTICO E IMAGENOLOGIA MEDSALUD LTDA,3071190.0,
EPSS02,SALUD TOTAL,900013939.0,CORPORACION PARA LA ATENCION Y EL DIAGNOSTICO DE ENFERMEDADES-MILAGROZ,184261535.0,
EPSS02,SALUD TOTAL,900015779.0,SOCIEDAD DE HEMODINAMIA SANTA MARIA S.A.S,43455892.0,
EPSS02,SALUD TOTAL,900016598.0,INSTITUTO CARDIOVASCULAR DEL CESAR S.A,366438543.0,
EPSS02,SALUD TOTAL,900017536.0,IPS SALUD INTEGRAL DE SUCRE SAS,10036117.0,
EPSS02,SALUD TOTAL,900025621.0,RADIOLOGIA E IMAGENES SAS,94689286.0,
EPSS02,SALUD TOTAL,900027397.0,CLINICA HIGEA IPS S.A.,123508246.0,
EPSS02,SALUD TOTAL,900031644.0,MEDYDONT IPS,15160603.0,
EPSS02,SALUD TOTAL,900033752.0,UNIVER PLUS,319689939.0,
EPSS02,SALUD TOTAL,900033859.0,ATENCION PREHOSPITALARIA Y SEGURIDAD INDUSTRIAL - APREHSI LTDA,27179720.0,
EPSS02,SALUD TOTAL,900036695.0,INTENSIVISTAS MRC IPS S.A,73429697.0,
EPSS02,SALUD TOTAL,900038024.0,ALIANZA DIAGNOSTICA S.A.,322804122.0,
EPSS02,SALUD TOTAL,900038926.0,PROMOTORA MEDICA Y ODONTOLOGICA DE ANTIOQUIA S.A,30239351.0,
EPSS02,SALUD TOTAL,900042103.0,EMPRESA SOCIAL DEL ESTADO HOSPITAL UNIVERSITARIO DEL CARIBE,321394876.0,
EPSS02,SALUD TOTAL,900045689.0,REHABILITACION FISICA INTEGRAL IPS EU,9185720.0,
EPSS02,SALUD TOTAL,900054563.0,UNIDAD DE CUIDADOS INTENSIVOS NEONATAL DEL BAJO SINU,13075175.0,
EPSS02,SALUD TOTAL,900055823.0,ESTUDIOS ENDOSCOPICOS S.A.S.,51737081.0,
EPSS02,SALUD TOTAL,900058218.0,EMPRESA SOCIAL DEL ESTADO CENTRO DE SALUD DE RICAURTE,9113583.0,
EPSS02,SALUD TOTAL,900061048.0,ESE HSOPITAL NIVEL I PUERTO RICO,2044559.0,
EPSS02,SALUD TOTAL,900064250.0,UNIDAD PRIMARIA DE ATENCION SAN NICOLAS,109208917.0,
EPSS02,SALUD TOTAL,900066345.0,E.S.E. HOSPITAL LOCAL DE PIEDECUESTA,1456783.0,
EPSS02,SALUD TOTAL,900066347.0,E.S.E. HOSPITAL REGIONAL SAN GIL,32264574.0,
EPSS02,SALUD TOTAL,900067136.0,E.S.E. HOSPITAL REGIONAL DE VELEZ,1819337.0,
EPSS02,SALUD TOTAL,900067169.0,EMPRESA SOCIAL DEL ESTADO HOSPITAL REGIONAL DE GARCIA ROVIRA,814402188.0,
EPSS02,SALUD TOTAL,900070354.0,SINUS CENTER,2010960.0,
EPSS02,SALUD TOTAL,900073081.0,SERVICLINICOS DROMEDICA S.A,1043091.0,
EPSS02,SALUD TOTAL,900074359.0,UCIMED S.A,31784549.0,
EPSS02,SALUD TOTAL,900077520.0,EMPRESA SOCIAL DEL ESTADO HOSPITAL LOCAL DE SAN CARLOS DE GUAROA,1216083.0,
EPSS02,SALUD TOTAL,900077584.0,COOPERATIVA DE SERVICIOS INTEGRALES DE SALUD RED MEDICRON IPS,5169611.0,
EPSS02,SALUD TOTAL,900077651.0,"UNIDAD DE GASTROENTEROLOGÍA, NUTRICIÓN Y ENDOSCOPIA PEDIATRICA SAS",18112556.0,
EPSS02,SALUD TOTAL,900081746.0,FUNDACION GRUPO INTEGRA,4821100.0,
EPSS02,SALUD TOTAL,900082202.0,CLINICA CENTRAL O.H.L. LTDA,409410103.0,
EPSS02,SALUD TOTAL,900085770.0,INTERMEDIOS E.D. LIMITADA,4038450.0,
EPSS02,SALUD TOTAL,900090247.0,CLINICA CARDIO INTEGRAL IPS. SAS,42515888.0,
EPSS02,SALUD TOTAL,900091143.0,EMPRESA SOCIAL DEL ESTADO PASTO SALUD E.S.E.,1934946.0,
EPSS02,SALUD TOTAL,900095253.0,IPS CLINICA PROSEGUIR SAS,79695756.0,
EPSS02,SALUD TOTAL,900099151.0,CLINICA BENEDICTO S.A,2115237.0,
EPSS02,SALUD TOTAL,900100089.0,VIDASER E.U.,143622912.0,
EPSS02,SALUD TOTAL,900103925.0,ELECTROFISIATRIA SAS,2964500.0,
EPSS02,SALUD TOTAL,900110940.0,INVERSIONES LUCEDMARB S.A,50397024.0,
EPSS02,SALUD TOTAL,900112364.0,SOCIEDAD CARDIOVASCULAR DEL CARIBE COLOMBIANO S.A.S,25396205.0,
EPSS02,SALUD TOTAL,900118856.0,LLANO SMILE S.A.S,3721661.0,
EPSS02,SALUD TOTAL,900119472.0,IPS TOLUSALUD LTDA,26482842.0,
EPSS02,SALUD TOTAL,900120098.0,INSTITUTO DE MEDICINA NUCLEAR S.A,19001807.0,
EPSS02,SALUD TOTAL,900123436.0,SOCIEDAD INTEGRAL DE ESPECIALISTAS EN SALUD S.A.S SIGLA SIES SALUD S.A.S,66708821.0,
EPSS02,SALUD TOTAL,900123612.0,NEFROUROS MOM SAS,77477285.0,
EPSS02,SALUD TOTAL,900138555.0,INVERSIONES MEREZ S.A.S,9551866.0,
EPSS02,SALUD TOTAL,900138758.0,CLINICA DE ESPECIALIDADES OFTALMOLOGICAS S.A.S,93770973.0,
EPSS02,SALUD TOTAL,900138815.0,UNIDAD MATERNO INFANTIL DEL TOLIMA S.A.,935604826.0,
EPSS02,SALUD TOTAL,900139876.0,COLCHARTER IPS SAS,14136500.0,
EPSS02,SALUD TOTAL,900141569.0,BIOTECNOLOGIA Y GENETICA S.A.S BIOTECGEN S.A.S,20231343.0,
EPSS02,SALUD TOTAL,900144943.0,FUNDACION AMIGOS DE LA SALUD VIRGEN DE MANARE,23569000.0,
EPSS02,SALUD TOTAL,900145581.0,EMPRESA SOCIAL DEL ESTADO ESE CENTRO I,1287427.0,
EPSS02,SALUD TOTAL,900145585.0,EMPRESA SOCIAL DEL ESTADO TIERRADENTRO ESE,2808680.0,
EPSS02,SALUD TOTAL,900145767.0,ESE SUR OCCIDENTE,1958220.0,
EPSS02,SALUD TOTAL,900146006.0,EMPRESA SOCIAL DEL ESTADO ESE NORTE 2,1442081.0,
EPSS02,SALUD TOTAL,900146332.0,CLINICENTRO DE REHABILITACION CARDIACA Y PULMONAR LTDA,2610792.0,
EPSS02,SALUD TOTAL,900148265.0,ANGIOGRAFIA DE COLOMBIA S.A.S.,68330362.0,
EPSS02,SALUD TOTAL,900150760.0,RESPIREMOS UNIDAD DE NEUMOLOGIA Y ENDOSCOPIA RESPIRATORIA DEL EJE CAFETERO S.A.S,13941544.0,
EPSS02,SALUD TOTAL,900152983.0,SABER VIVIR SABANA SAS,2631265.0,
EPSS02,SALUD TOTAL,900161856.0,SONIA VALENCIA REHABILITACION INTEGRAL IPS SAS,47229155.0,
EPSS02,SALUD TOTAL,900166169.0,VASCUMAG LTDA. LABORATORIO VASCULAR DEL MAGDALENA,2421036.0,
EPSS02,SALUD TOTAL,900171211.0,GLOBAL LIFE AMBULANCIAS SAS,45029386.0,
EPSS02,SALUD TOTAL,900172745.0,UNIDAD DE DIAGNOSTICO GINECOLOGICO Y PRENATAL SER MUJER S.A.S,5795648.0,
EPSS02,SALUD TOTAL,900177624.0,ANASHIWAYA IPSI,11788706.0,
EPSS02,SALUD TOTAL,900179573.0,AMBULANCIA RESCATE 467 SAS,51518647.0,
EPSS02,SALUD TOTAL,900181419.0,MEINTEGRAL S.A.S,136212697.0,
EPSS02,SALUD TOTAL,900188353.0,INSTITUTO MEDICO OFTALMOLOGICO DE COLOMBIA LTDA,115025235.0,
EPSS02,SALUD TOTAL,900190045.0,ESE HOSPITAL REGIONAL MANUELA BELTRAN,22910787.0,
EPSS02,SALUD TOTAL,900192428.0,ESE. HOSPITAL LUIS CARLOS GALAN SARMIENTO DE CHARALA,2131033.0,
EPSS02,SALUD TOTAL,900193988.0,UROCLINICA DE CORDOBA SAS,143199697.0,
EPSS02,SALUD TOTAL,900196201.0,PROGRAMA MADRE CANGURO INTEGRAL LTDA,2508908.0,
EPSS02,SALUD TOTAL,900196346.0,ESE HOSPITAL NUESTRA SEÑORA DEL CARMEN,3586500.0,
EPSS02,SALUD TOTAL,900196347.0,EMPRESA SOCIAL DEL ESTADO HOSPITAL LA DIVINA MISERICORDIA,133680443.0,
EPSS02,SALUD TOTAL,900196366.0,E.S.E HOSPITAL SAN ANTONIO DE PADUA,6381362.0,
EPSS02,SALUD TOTAL,900201836.0,"CENTRO DE INVESTIGACIÓN EN REUMATOLOGÍA Y ESPECIALIDADES MÉDICAS SAS ""CIREEM SAS""",6286700.0,
EPSS02,SALUD TOTAL,900202290.0,AUDIOSALUD INTEGRAL SAS,8424146.0,
EPSS02,SALUD TOTAL,900204617.0,MEDICUC IPS LTDA,189616874.0,
EPSS02,SALUD TOTAL,900205118.0,CENTRO CARDIOVASCULAR DE CALDAS S.A.,209426424.0,
EPSS02,SALUD TOTAL,900205591.0,INSTITUCIÓN PRESTADORA DE SERVICIOS DE SALUD INDÍGENA MANEXKA IPSI,2199444.0,
EPSS02,SALUD TOTAL,900206529.0,DIAGNOSTICAR MILLAN LTDA,11183828.0,
EPSS02,SALUD TOTAL,900210981.0,CORPORACIÓN HOSPITALARIA JUAN CIUDAD,1654956.0,
EPSS02,SALUD TOTAL,900211460.0,E.S.E. SOR TERESA ADELE,1239200.0,
EPSS02,SALUD TOTAL,900211477.0,E.S.E. RAFAEL TOVAR POVEDA,1841844.0,
EPSS02,SALUD TOTAL,900214926.0,CLINICA DE ESPECIALISTAS GUAJIRA S.A.,1865257.0,
EPSS02,SALUD TOTAL,900215983.0,CLINICA BELO HORIZONTE,44901584.0,
EPSS02,SALUD TOTAL,900217078.0,I.P.S. FISINOVA S.A.S,29934665.0,
EPSS02,SALUD TOTAL,900218628.0,CENTRO MEDICO SAN LUIS CLINICA QUIRURGICA S.A.S.,6126767.0,
EPSS02,SALUD TOTAL,900221747.0,IPS ASESORIAS HORIZONTES DEL NORTE SAS,65638310.0,
EPSS02,SALUD TOTAL,900223749.0,FUNDACION UNIDAD DE CUIDADOS INTENSIVOS DOÑA PILAR,72812208.0,
EPSS02,SALUD TOTAL,900226451.0,ESPECIALIDADES MEDICAS METROPOLITANAS S.A.S.,7188852.0,
EPSS02,SALUD TOTAL,900227844.0,LABORATORIO CLINICO MARTINEZ SAS,16284008.0,
EPSS02,SALUD TOTAL,900231793.0,CLINICA NEFROUROS SAS,28028859.0,
EPSS02,SALUD TOTAL,900231829.0,I.P.S GOLEMAN SERVICIO INTEGRAL S.A.S.,12256174.0,
EPSS02,SALUD TOTAL,900233294.0,CLINICA GENERAL DEL CARIBE S.A.,48269545.0,
EPSS02,SALUD TOTAL,900236850.0,CENTRO ONCOLOGICO DE ANTIOQUIA SA,402153769.0,
EPSS02,SALUD TOTAL,900237812.0,PREVICARE LTDA,5676664.0,
EPSS02,SALUD TOTAL,900240018.0,LOS COMUNEROS HOSPITAL UNIVERSITARIO DE BUCARAMANGA,2102702.0,
EPSS02,SALUD TOTAL,900240626.0,GRUPO SALUD CORDOBA SAS,32821961.0,
EPSS02,SALUD TOTAL,900242742.0,FABILU S.A.S,17863878.0,
EPSS02,SALUD TOTAL,900244203.0,CLINICA NEUROREHABILITAR LTDA,1643460.0,
EPSS02,SALUD TOTAL,900244429.0,TECNOVIDA DIAGNOSTICO POR IMAGENES S.A.S.,9639708.0,
EPSS02,SALUD TOTAL,900246313.0,IPS INTEGRAL SOMOS SALUD SAS,11316425.0,
EPSS02,SALUD TOTAL,900246954.0,CLINICA DE SALUD MENTAL Y REHABILITACION INTEGRAL MANANTIALES LTDA.,33076629.0,
EPSS02,SALUD TOTAL,900248882.0,CLINICA PORTOAZUL S.A SIGLA CPA,178498832.0,
EPSS02,SALUD TOTAL,900249425.0,PHARMASAN S.A.S.,9166614.0,
EPSS02,SALUD TOTAL,900250156.0,CENTRO MEDICO Y DE REHABILITACION E.U.,3721280.0,
EPSS02,SALUD TOTAL,900259421.0,EMMANUEL INSTITUTO DE REHABILITACION Y HABILITACION INFANTIL S.AS,10776675.0,
EPSS02,SALUD TOTAL,900261353.0,FUNDACION HOSPITAL SAN VICENTE DE PAUL RIONEGRO,131226058.0,
EPSS02,SALUD TOTAL,900267064.0,INVERSIONES AZALUD S.A.S,5141021.0,
EPSS02,SALUD TOTAL,900267104.0,UNIDAD INTEGRAL DE REHABILITACION CARDIO-PULMONAR E.U.,10263730.0,
EPSS02,SALUD TOTAL,900269029.0,FUNDACION CENTRO COLOMBIANO DE EPILEPSIA Y ENFERMEDADES NEUROLOGICAS,76634823.0,
EPSS02,SALUD TOTAL,900272582.0,CLINICA SAN JUAN BAUTISTA S.A.S.,49429900.0,
EPSS02,SALUD TOTAL,900274663.0,SALUD LLANOS IPS LTDA,1331040.0,
EPSS02,SALUD TOTAL,900277244.0,HELPHARMA SAS,1882024.0,
EPSS02,SALUD TOTAL,900277630.0,CLINICA MARYBAU LA LOMA LTDA,52014547.0,
EPSS02,SALUD TOTAL,900278642.0,AMBULANCIAS SANTA RITA S.A.S,28444097.0,
EPSS02,SALUD TOTAL,900279660.0,PROMOTORA BOCAGRANDE S.A. PROBOCA S.A.,7411020.0,
EPSS02,SALUD TOTAL,900284591.0,CENTRO CARDIOVASCULAR COLOMBIANO SAS SIGLA CC CARDIOVASCULAR SAS,93340854.0,
EPSS02,SALUD TOTAL,900291018.0,CLINICA LOS NOGALES SAS,3922996628.0,
EPSS02,SALUD TOTAL,900292961.0,CENTRO CARDIOLOGICO TODO POR EL CORAZON SAS,34110640.0,
EPSS02,SALUD TOTAL,900293837.0,CENTRO MEDICO DE ATENCION NEUROLOGICA NEUROLOGOS DE OCCIDENTE SAS,15363425.0,
EPSS02,SALUD TOTAL,900293923.0,IPS ESPECIALIZADA S.A.,2948469852.0,
EPSS02,SALUD TOTAL,900294794.0,COMITE DE ESTUDIOS MEDICOS S.A.S,60092120.0,
EPSS02,SALUD TOTAL,900296050.0,ODONTO TOTAL E.U.,11424199.0,
EPSS02,SALUD TOTAL,900304417.0,SALUD DOMICILIARIA INTEGRAL SALUD & S.A.S,19056215.0,
EPSS02,SALUD TOTAL,900304958.0,SOCIEDAD SAN JOSE DE TORICES S.A,78543767.0,
EPSS02,SALUD TOTAL,900305723.0,INSTITUTO DE REHABILITACION Y HABILITACION INFANTIL.EBENEZER. LTDA,6036800.0,
EPSS02,SALUD TOTAL,900306367.0,BIOGENETICA DIAGNOSTICA SAS,14010888.0,
EPSS02,SALUD TOTAL,900307907.0,POLICLINICO DEL CAFÉ S.A.S.,23843043.0,
EPSS02,SALUD TOTAL,900315383.0,NEUROLOGIA INTEGRAL DE CALDAS S.A.S,9835700.0,
EPSS02,SALUD TOTAL,900319336.0,ODONT JOMAR VALLEDUPAR,31207961.0,
EPSS02,SALUD TOTAL,900324225.0,"SOCIEDAD PARA LA ATENCION MEDICA E IMAGENES DIAGNOSTICAS SAS ""SOMID SAS """,6780004.0,
EPSS02,SALUD TOTAL,900329923.0,GASTROLAP S.A.S.,34529388.0,
EPSS02,SALUD TOTAL,900338671.0,IPS OXI CARE S.A.S,11829256.0,
EPSS02,SALUD TOTAL,900341157.0,INSTITUTO DE GASTROENTEROLOGIA Y HEPATOLOGIA DEL ORIENTE S.A.S,22296665.0,
EPSS02,SALUD TOTAL,900341409.0,ESTUDIOS OFTALMOLOGICOS SAS,179766675.0,
EPSS02,SALUD TOTAL,900342064.0,SOCIEDAD COMERCIALIZADORA DE INSUMOS Y SERVICIOS MÉDICOS S.A.S,307125837.0,
EPSS02,SALUD TOTAL,900345765.0,EMPRESA MULTIACTIVA DE SALUD,34140034.0,
EPSS02,SALUD TOTAL,900346322.0,UNIDAD VIDEO DIAGNOSTICA DE LA MUJER S.A.S.,3385900.0,
EPSS02,SALUD TOTAL,900346953.0,CARDIOSALUD EJE CAFETERO S.A.S.,43942801.0,
EPSS02,SALUD TOTAL,900347399.0,EXPORT HEALTH S.A.S,5704580.0,
EPSS02,SALUD TOTAL,900353107.0,UNIDAD MÉDICA ONCOLÓGICA S.A.S.,8584039.0,
EPSS02,SALUD TOTAL,900358922.0,HABILITAR DEL CARIBE S.A.S,1019200.0,
EPSS02,SALUD TOTAL,900359092.0,INSTITUTO NACIONAL DE DEMENCIAS EMANUEL SAS,15515286.0,
EPSS02,SALUD TOTAL,900368327.0,MEDICAL HOMECARE S.A.S.,2622422.0,
EPSS02,SALUD TOTAL,900369003.0,HOGARSALUD IPS SOCIEDAD POR ACCIONES SIMPLIFICADAS,6465958.0,
EPSS02,SALUD TOTAL,900373690.0,UNIDHOS S.A.S,10336715.0,
EPSS02,SALUD TOTAL,900377863.0,UNION DE CIRUJANOS S.A.S.,47839989.0,
EPSS02,SALUD TOTAL,900379727.0,AUVIMER SALUD INTEGRAL EN CASA SAS,2540634.0,
EPSS02,SALUD TOTAL,900385265.0,HOUSE CARE MEDICAL IPS S.A.S,19705800.0,
EPSS02,SALUD TOTAL,900385457.0,ASISTENCIA Y LOGISTICA PRE HOSPITALARIA DE ANTIOQUIA S.A.S,22264506.0,
EPSS02,SALUD TOTAL,900385628.0,MEDICENTRO FAMILIAR IPS SAS,19764131.0,
EPSS02,SALUD TOTAL,900386591.0,GYO MEDICAL I.P.S. S.A.S.,19155005.0,
EPSS02,SALUD TOTAL,900390423.0,PROMOTORA CLINICA ZONA FRANCA DE URABA SAS,88898725.0,
EPSS02,SALUD TOTAL,900394021.0,MEDICLINICOS IPS S.A.S,114112908.0,
EPSS02,SALUD TOTAL,900402462.0,IPS INTEGRAL SANTA MARIA S.A.S,2799566.0,
EPSS02,SALUD TOTAL,900404554.0,SOCIEDAD REGIONAL DE CIRUGIA OCULAR S.A.S.,11212084.0,
EPSS02,SALUD TOTAL,900407111.0,GENCELL PHARMA S.A.S,93512984.0,
EPSS02,SALUD TOTAL,900408220.0,NUEVA CLINICA SAGRADO CORAZON S.A.S,15728446.0,
EPSS02,SALUD TOTAL,900412760.0,AMBULANCIAS PROYECTAR SAS,11489636.0,
EPSS02,SALUD TOTAL,900413177.0,FUNDACION FUNPAZ,46100350.0,
EPSS02,SALUD TOTAL,900413905.0,ALIVIUM S.A.S,3782000.0,
EPSS02,SALUD TOTAL,900413988.0,NP MEDICAL IPS SAS,144580663.0,
EPSS02,SALUD TOTAL,900420664.0,GRUPO EMPRESARIAL SALUD POSITIVA S.A.S.,106515405.0,
EPSS02,SALUD TOTAL,900420751.0,SPORT MEDICAL CENTER IPS GUSTAVO PORTELA SAS,2375040.0,
EPSS02,SALUD TOTAL,900421895.0,FUNDACIÓN CLINICA DEL NORTE,18015617.0,
EPSS02,SALUD TOTAL,900422064.0,CENTRO ESPECIALIZADO DE UROLOGIA S.A.S,5846518.0,
EPSS02,SALUD TOTAL,900423126.0,FUNDACION CLINICA MATERNO INFANTIL ADELA DE CHAR,10948834.0,
EPSS02,SALUD TOTAL,900431550.0,CLINICA LA VICTORIA S.A.S.,3929518.0,
EPSS02,SALUD TOTAL,900434332.0,LABORATORIO CLINICO SANTA LUCIA IPS S.A.S.,61597457.0,
EPSS02,SALUD TOTAL,900436223.0,FUNDACION CONEXION IPS,67290155.0,
EPSS02,SALUD TOTAL,900438572.0,CENTRO TERAPEUTICO RE-ENCONTRARSE S.A.S.,105807155.0,
EPSS02,SALUD TOTAL,900439009.0,CENTRO NEURORADIONCOLOGICO DE CARTAGENA SAS,11544400.0,
EPSS02,SALUD TOTAL,900444808.0,IPS SALUD MEDICAL S.A.S.,39810700.0,
EPSS02,SALUD TOTAL,900448414.0,UNIDAD INTEGRAL DE ATENCION SILOE S.A.S.,5114960.0,
EPSS02,SALUD TOTAL,900449203.0,ADMDATA S.A.S,8424333.0,
