EPSS17,FAMISANAR,800014918.0,E.S.E. HOSPITAL UNIVERSITARIO ERASMO MEOZ,77971792.0,
EPSS17,FAMISANAR,800018233.0,SOMECA MALAMBO,8045721.0,
EPSS17,FAMISANAR,800024744.0,UNIDAD DE CIRUGIA DEL TOLIMA,2153627.0,
EPSS17,FAMISANAR,800025755.0,IPS CLINICA SAN IGNACIO LTDA,3754520.0,
EPSS17,FAMISANAR,800026173.0,ESE HOSPITAL HELI MORENO BLANCO,1645937.0,
EPSS17,FAMISANAR,800030924.0,E.S.E. HOSPITAL LA BUENA ESPERANZA,1215877.0,
EPSS17,FAMISANAR,800033723.0,SERVICIOS MEDICOS OLIMPUS I.P.S. SOCIEDAD POR ACCIONES SIMPLIFICADA,18786230.0,
EPSS17,FAMISANAR,800037021.0,HOSPITAL DEPARTAMENTAL DE GRANADA - EMPRESA SOCIAL DEL META,185955305.0,
EPSS17,FAMISANAR,800037979.0,E.S.E. HOSPITAL LOCAL DE PUERTO LOPEZ,26455754.0,
EPSS17,FAMISANAR,800044402.0,INVERSIONES MEDICAS DE ANTIOQUIA S.A. CLINICA LAS VEGAS,2446093.0,
EPSS17,FAMISANAR,800048880.0,LITOMEDICA S.A,121204532.0,
EPSS17,FAMISANAR,800058016.0,EMPRESA SOCIAL DEL ESTADO METROSALUD,4577318.0,
EPSS17,FAMISANAR,800067515.0,"CLINICA LA MILAGROSA S,A,",129904740.0,
EPSS17,FAMISANAR,800074996.0,CLINICA DE CIRUGIA OCULAR LIMITADA,4490003.0,
EPSS17,FAMISANAR,800075650.0,EMPRESA SOCIAL DEL ESTADO HOSPITAL SANTO TOMAS,7679986.0,
EPSS17,FAMISANAR,800084206.0,EMPRESA SOCIAL DEL ESTADO INSTITUTO DE SALUD DE BUCARAMANGA,2340040.0,
EPSS17,FAMISANAR,800085883.0,LABORATORIO DE ORTESIS Y PROTESIS GILETE Y CIA. LIMITADA,34010880.0,
EPSS17,FAMISANAR,800087565.0,SYNLAB COLOMBIA S.A.S.,2680000.0,
EPSS17,FAMISANAR,800090749.0,CLINICA PIEDECUESTA S.A.,48480736.0,
EPSS17,FAMISANAR,800094439.0,CATME S.A.S.,156505200.0,
EPSS17,FAMISANAR,800099652.0,CLINICA LA CAROLINA S.A,11490357.0,
EPSS17,FAMISANAR,800099778.0,ASOCIACIÓN NIÑOS DE PAPEL,15739333.0,
EPSS17,FAMISANAR,800099860.0,E.S.E. HOSPITAL SAN RAFAEL DE PACHO,1236295093.0,
EPSS17,FAMISANAR,800119574.0,SOCIEDAD DE SERVICIOS OCULARES S.A.S-OPTISALUD,11508061.0,
EPSS17,FAMISANAR,800122186.0,UROMEDICA LTDA,109725130.0,
EPSS17,FAMISANAR,800125697.0,E.S.E. HOSPITAL NELSON RESTREPO MARTINEZ,13170711.0,
EPSS17,FAMISANAR,800129856.0,CLINICA DE LA COSTA S.A.S.,7201709.0,
EPSS17,FAMISANAR,800135582.0,FUNDACION ALEJANDRO LONDOÑO,17665909.0,
EPSS17,FAMISANAR,800139444.0,CLINICA OFTALMOLOGICA INTEGRAL COI LTDA,1078000.0,
EPSS17,FAMISANAR,800149453.0,CPO SA,9702734.0,
EPSS17,FAMISANAR,800152970.0,HOSPITAL REGIONAL DE MIRAFLORES EMPRESA SOCIAL DEL ESTADO,4741447.0,
EPSS17,FAMISANAR,800156469.0,IMÁGENES DIAGNOSTICAS DEL LLANO S.A.,62419953.0,
EPSS17,FAMISANAR,800174123.0,ESE HOSPITAL DE SANTO TOMAS,1452760.0,
EPSS17,FAMISANAR,800174375.0,E.S.E. HOSPITAL SAN VICENTE DE PAUL DE FOMEQUE,125638761.0,
EPSS17,FAMISANAR,800175901.0,CLINICA EMPERATRIZ SAS,24230806.0,
EPSS17,FAMISANAR,800176807.0,"PROFESIONALES DE LA SALUD S.A. ""PROINSALUD S.A.""",2564986.0,
EPSS17,FAMISANAR,800179870.0,HOSPITAL SAN ANDRES E.S.E.,10799115.0,
EPSS17,FAMISANAR,800179966.0,IPS CLINICA REINA CATALINA S.A.S.,70433449.0,
EPSS17,FAMISANAR,800183943.0,CLINICA SANTA MARIA SAS,6954984.0,
EPSS17,FAMISANAR,800184080.0,CLINICA OFTALMOLOGICA PAREDES SAS,21443917.0,
EPSS17,FAMISANAR,800187260.0,INSTITUTO DE ENFERMEDADES DIGESTIVAS DE COLOMBIA S.A.S,22738392.0,
EPSS17,FAMISANAR,800189531.0,CLINICA ODONTOLOGICA PROTECCION ORAL S.A.S. SIGLA COPO S.A.S.,12162324.0,
EPSS17,FAMISANAR,800191101.0,ESE HOSPITAL SAN VICENTE DE PAUL,1310576.0,
EPSS17,FAMISANAR,800191643.0,ESE HOSPITAL REGIONNAL II NIVEL DE SAN MARCOS,3545161.0,
EPSS17,FAMISANAR,800193490.0,EMPRESA SOCIAL DEL ESTADO HOSPITAL SANTA ANA NIVEL I DEL MUNICIPIO DE FALAN,1412534.0,
EPSS17,FAMISANAR,800193801.0,CENTRO OFTALMOLOGICO SURCOLOMBIANO LTDA,61426679.0,
EPSS17,FAMISANAR,800193989.0,CENTRO DIAGNOSTICO DE ESPECIALISTAS LTDA,1026238.0,
EPSS17,FAMISANAR,800197424.0,ASOCIACION MEDICA DE MEDICINA NUCLEAR LTDA NUCLEAR 2000 LTDA,39805221.0,
EPSS17,FAMISANAR,800201726.0,FUNDACION POLICLINICA CIENAGA,44140744.0,
EPSS17,FAMISANAR,800204153.0,E.S.E. HOSPITAL SAN VICENTE DE PAUL DE LORICA,4201909.0,
EPSS17,FAMISANAR,800204497.0,ESE HOSPITAL SAN JOSE DE GUACHETA,13222734.0,
EPSS17,FAMISANAR,800209891.0,CLINICA ASOTRAUMA SAS,11824095.0,
EPSS17,FAMISANAR,800210375.0,PROCARDIO SERVICIOS MEDICOS INTEGRALES S.A.S.,27912664.0,
EPSS17,FAMISANAR,800213942.0,E.S.E. HOSPITAL SANTA CRUZ,10023802.0,
EPSS17,FAMISANAR,800215758.0,CLINICA SANTA CRUZ DE LA LOMA S.A,35316669.0,
EPSS17,FAMISANAR,800222844.0,RADIOIMAGENES RADIOLOGOS ASOCIADOS S.A.S.,60160755.0,
EPSS17,FAMISANAR,800223618.0,MEDINUCLEAR S.A.S,35827482.0,
EPSS17,FAMISANAR,800228215.0,CENTRO DE ALTA TECNOLOGIA DIAGNOSTICA DEL EJE CAFETERO S.A. - CEDICAF S.A.,1742804.0,
EPSS17,FAMISANAR,800230659.0,PORSALUD SAS,29277836.0,
EPSS17,FAMISANAR,800231235.0,EMPRESA SOCIAL DEL ESTADO HOSPITAL UNIVERSITARIO SAN JORGE,155683651.0,
EPSS17,FAMISANAR,800233471.0,SO SERVICIOS MEDICOS Y OFTALMOLOGICOS S.A.S,4670663.0,
EPSS17,FAMISANAR,800234860.0,LITOTRICIA S.A.,19482042.0,
EPSS17,FAMISANAR,800239977.0,REHABILITADORES ASOCIADOS LTDA,3213100.0,
EPSS17,FAMISANAR,800242197.0,CLINICA SANTA ANA S.A.S,15439560.0,
EPSS17,FAMISANAR,800247350.0,EMPRESA SOCIAL DEL ESTADO CENTRO DERMATOLOGICO FEDERICO LLERAS ACOSTA,3193819.0,
EPSS17,FAMISANAR,800249700.0,INSTITUTO NEUMOLOGICO DEL ORIENTE S.A.,28174494.0,
EPSS17,FAMISANAR,800254850.0,EMPRESA SOCIAL DEL ESTADO HOSPITAL SANTA ANA,1577405.0,
EPSS17,FAMISANAR,800255963.0,CLINICA SAN JOSE SAS,189144809.0,
EPSS17,FAMISANAR,801001323.0,CLINICA EL PRADO INSTITUTO ESPECIALIZADO EN SALUD MENTAL LTDA,30349524.0,
EPSS17,FAMISANAR,801001440.0,RED SALUD ARMENIA ESE UNIDAD INTERMEDIA DEL SUR,4432118.0,
EPSS17,FAMISANAR,801001969.0,ASPRODONTO SAS,1556142.0,
EPSS17,FAMISANAR,802000909.0,CLINICA LOS ALMENDROS SAS,25838119.0,
EPSS17,FAMISANAR,802001084.0,IPS CLINICA SANTA ANA DE BARANOA,20142954.0,
EPSS17,FAMISANAR,802003081.0,E.S.E. HOSPITAL MUNICIPAL DE SABANAGRANDE,2915374.0,
EPSS17,FAMISANAR,802003414.0,EMPRESA SOCIAL DEL ESTADO HOSPITAL DE JUAN DE ACOSTA,5004562.0,
EPSS17,FAMISANAR,802004166.0,NEFROSERVICIOS S.A.S,20080922.0,
EPSS17,FAMISANAR,802004326.0,LABORATORIO CLINICO FALAB S.A.S.,3694600.0,
EPSS17,FAMISANAR,802004549.0,EMPRESA SOCIAL DEL ESTADO CENTRO DE SALUD DE POLONUEVO,1722946.0,
EPSS17,FAMISANAR,802007650.0,HOSPITAL VERA JUDITH IMITOLA VLLANUEVA E.S.E,2442567.0,
EPSS17,FAMISANAR,802009783.0,CLINICA SAN RAFAEL LTDA,31765168.0,
EPSS17,FAMISANAR,802012998.0,UNIÓN VITAL S.A.S,26779008.0,
EPSS17,FAMISANAR,802013835.0,CLINICAS ATENAS LTDA IPS,17422546.0,
EPSS17,FAMISANAR,802016266.0,INVERSIONES IMÁGENES VITALES DE LA COSTA S.A,58274126.0,
EPSS17,FAMISANAR,802020128.0,INVERCLINICAS S.A.S.,6547291.0,
EPSS17,FAMISANAR,802021182.0,I.P.S. UNIDAD MEDICA ETICA S.A.S.,10001684.0,
EPSS17,FAMISANAR,802022775.0,CENTRO DE SALUD AGRUPASALUD IPS SAS,12873318.0,
EPSS17,FAMISANAR,804005555.0,E.S.E. HOSPITAL SANTO DOMINGO SAVIO,11573384.0,
EPSS17,FAMISANAR,804006167.0,AUDIOMIC S.A.S,1958068.0,
EPSS17,FAMISANAR,804008792.0,FORPRESALUD IPS SAS,1152000.0,
EPSS17,FAMISANAR,804008809.0,CLINICA SAN JOSE IPS LTDA,4801574.0,
EPSS17,FAMISANAR,804010334.0,MEDIIMPLANTES S.A,19387212.0,
EPSS17,FAMISANAR,804011481.0,VIVASALUD I.P.S. S.A.S,55645252.0,
EPSS17,FAMISANAR,804017235.0,IMAGENES DE LA SABANA SAS,153459311.0,
EPSS17,FAMISANAR,805016006.0,"AMIGOS DE LA SALUD, AMISALUD SAS",1548471.0,
EPSS17,FAMISANAR,805017681.0,GAMANUCLEAR LTDA,14166475.0,
EPSS17,FAMISANAR,805023423.0,SOCIEDAD N.S.D.R. S.A.S,28579017.0,
EPSS17,FAMISANAR,805027287.0,E.S.E. RED DE SALUD DEL NORTE EMPRESA SOCIAL DEL ESTADO HOSPITAL JOAQUIN PAZ BORRERO,3433732.0,
EPSS17,FAMISANAR,805027289.0,E.S.E. RED DE SALUD DE LADERA EMPRESA SOCIAL DEL ESTADO HOSPITAL CAÑAVERALEJO,3360947.0,
EPSS17,FAMISANAR,806004756.0,CENTRO DE CIRUGIA LASER OCULAR LTDA,3531873.0,
EPSS17,FAMISANAR,806005602.0,ESE HOSPITAL LOCAL TURBACO,10614396.0,
EPSS17,FAMISANAR,806007650.0,CENTRO RADIO-ONCOLOGICO DEL CARIBE S.A.S.,132344345.0,
EPSS17,FAMISANAR,806007923.0,E.S.E. HOSPITAL LOCAL ARJONA,5646357.0,
EPSS17,FAMISANAR,806008439.0,CLINICA CARTAGENA DEL MAR S.A.S,117785186.0,
EPSS17,FAMISANAR,806008935.0,FUNDACION CASA DEL NIÑO IPS,3965000.0,
EPSS17,FAMISANAR,806010305.0,ESE HOSPITAL LOCAL CARTAGENA DE INDIAS,4656447.0,
EPSS17,FAMISANAR,806013147.0,LAFONT ENCASA IPS,4357360.0,
EPSS17,FAMISANAR,806013568.0,NEURODINAMIA S.A,5803516.0,
EPSS17,FAMISANAR,806015201.0,GESTION SALUD S.A.S.,97373790.0,
EPSS17,FAMISANAR,806016225.0,CENTRO MEDICO BUENOS AIRES SAS,29300507.0,
EPSS17,FAMISANAR,806016870.0,UNIDAD DE PATOLOGIA CLINICA S.A.S.,23727428.0,
EPSS17,FAMISANAR,807004352.0,EMPRESA SOCIAL DEL ESTADO IMSALUD,3423200.0,
EPSS17,FAMISANAR,807004631.0,E.S.E.HOSPITAL LOCAL VILLA DEL ROSARIO,2066191.0,
EPSS17,FAMISANAR,808002168.0,COOPERATIVA MULTIACTIVA DEL SUMAPAZ SIGLA COOPSUMAPAZ,3359008.0,
EPSS17,FAMISANAR,808003500.0,HOSPITAL ISMAEL SILVA E.S.E.,209736290.0,
EPSS17,FAMISANAR,809001086.0,HOSPITAL SERAFIN MONTAÑA CUELLAR ESE,1070265.0,
EPSS17,FAMISANAR,809001482.0,CLINICA DE OJOS DEL TOLIMA S.A.S,94854976.0,
EPSS17,FAMISANAR,809002097.0,HOSPITAL NUESTRA SEÑORA DEL ROSARIO DE CHIQUINQUIRA DEL MUNICIPIO DE COELLO TOLIMA E.S.E,2081719.0,
EPSS17,FAMISANAR,809002913.0,PROMOVER SAS,8102858.0,
EPSS17,FAMISANAR,809003128.0,HOSPITAL NUESTRA SEÑORA DE FATIMA E.S.E,12717178.0,
EPSS17,FAMISANAR,809003590.0,UNIDAD DE SALUD DE IBAGUE EMPRESA SOCIAL DEL ESTADO,92863375.0,
EPSS17,FAMISANAR,809004280.0,HOSPITAL RICARDO ACOSTA NIVEL I EMPRESA SOCIAL DEL ESTADO,2629362.0,
EPSS17,FAMISANAR,809005452.0,HOSPITAL SANTA ROSA DE LIMA E. S. E.,1983099.0,
EPSS17,FAMISANAR,809005719.0,HOSPITAL SAN VICENTE E.S.E,1533390.0,
EPSS17,FAMISANAR,809009066.0,CLINICA LOS REMANSOS INSTITUTO TOLIMENSE DE SALUD MENTAL S.A.S,1190655.0,
EPSS17,FAMISANAR,809011517.0,MEDICINA INTENSIVA DEL TOLIMA S.A.,135452403.0,
EPSS17,FAMISANAR,810000912.0,E.S.E. HOSPITAL DEPARTAMENTAL SAGRADO CORAZON,1644968.0,
EPSS17,FAMISANAR,810000913.0,EMPRESA SOCIAL DEL ESTADO HOSPITAL SAN FELIX LA DORADA CALDAS,98289829.0,
EPSS17,FAMISANAR,810003245.0,CLÍNICA OSPEDALE MANIZALES S.A,24988786.0,
EPSS17,FAMISANAR,811041784.0,SUPLEMEDICOS S.A.S,105004290.0,
EPSS17,FAMISANAR,812002836.0,ESE CAMU DEL PRADO,1881890.0,
EPSS17,FAMISANAR,812002958.0,CLINICA LA TRINIDAD I.P.S. LTDA,13305822.0,
EPSS17,FAMISANAR,812005522.0,FUNDACION AMIGOS DE LA SALUD,68889767.0,
EPSS17,FAMISANAR,812005726.0,EMPRESA SOCIAL DEL ESTADO VIDASINU,2037811.0,
EPSS17,FAMISANAR,813002933.0,E.S.E. HOSPITAL DIVINO NIÑO DE RIVERA,4440817.0,
EPSS17,FAMISANAR,813002940.0,EMPRESA SOCIAL DEL ESTADO MARIA AUXILIADORA DE GARZON,3406173.0,
EPSS17,FAMISANAR,813004018.0,ESE CENTRO DE SALUD MIGUEL BARRETO LOPEZ DE TELLO,1172226.0,
EPSS17,FAMISANAR,813005265.0,E.S.E. CARMEN EMILIA OSPINA DE NEIVA,173115296.0,
EPSS17,FAMISANAR,813008574.0,MEGASALUD IPS SAS,7231196.0,
EPSS17,FAMISANAR,813011566.0,EMPRESA SOCIAL DEL ESTADO HOSPITAL DEL PERPETUO SOCORRO,1303654.0,
EPSS17,FAMISANAR,813011577.0,CLINICA UROS S.A.S - TORRE A,143170364.0,
EPSS17,FAMISANAR,814003448.0,AUDIOCOM IPS,37535947.0,
EPSS17,FAMISANAR,814004822.0,INSTITUTO RADIOLOGICO DEL SUR SAS,3801737.0,
EPSS17,FAMISANAR,814006170.0,CLINICA DE ORTOPEDIA Y FRACTURAS TRAUMEDICAL S.A.S,57782842.0,
EPSS17,FAMISANAR,814006732.0,CENTRO DE SALUD DE CONSACA EMPRESA SOCIAL DEL ESTADO,1049732.0,
EPSS17,FAMISANAR,816002451.0,CALCULASER S.A.,36488491.0,
EPSS17,FAMISANAR,816005003.0,EMPRESA SOCIAL DEL ESTADO SALUD PEREIRA,1836685.0,
EPSS17,FAMISANAR,816007055.0,INSTITUTO DE EPILEPSIA Y PARKINSON DEL EJE CAFETERO S.A,3420950.0,
EPSS17,FAMISANAR,817003166.0,CLÍNICA LA ESTANCIA S. A.,10102868.0,
EPSS17,FAMISANAR,819000134.0,CENTRO CARDIOVASCULAR DEL MAGDALENA S.A.,63894343.0,
EPSS17,FAMISANAR,819000413.0,CLINICA GENERAL DE CIENAGA S. A. S.,2502529.0,
EPSS17,FAMISANAR,819001107.0,EMPRESA SOCIAL DEL ESTADO HOSPITAL LOCAL ALEJANDRO MAESTRE SIERRA,1064400.0,
EPSS17,FAMISANAR,819002025.0,E.S.E HOSPITAL SANTANDER HERRERA DE PIVIJAY,3286912.0,
EPSS17,FAMISANAR,819002551.0,EMPRESA SOCIAL DEL ESTADO CENTRO DE SALUD PAZ DEL RIO,5799520.0,
EPSS17,FAMISANAR,819003863.0,PREVENCION Y SALUD INTEGRAL PARA LA FAMILIA IPS LTDA,1111512.0,
EPSS17,FAMISANAR,819006193.0,INSTITUTO NEUROPSIQUIATRICO NUESTRA SEÑORA DEL CARMEN INSECAR,46279105.0,
EPSS17,FAMISANAR,820001181.0,ASORSALUD SM LTDA,122639745.0,
EPSS17,FAMISANAR,820001277.0,CENTRO DE CANCEROLOGÍA DE BOYACÁ SAS.,192370217.0,
EPSS17,FAMISANAR,820002654.0,DISTRIMEQ S.A.S.,14688482.0,
EPSS17,FAMISANAR,820002854.0,ESE CENTRO DE SALUD NUESTRA SEÑORA DE LA PAZ,1036760.0,
EPSS17,FAMISANAR,820002928.0,NEFROBOYACA SAS,33054105.0,
EPSS17,FAMISANAR,820003291.0,EMPRESA SOCIAL DEL ESTADO RAFAEL SALGADO DE MARIPI,1479820.0,
EPSS17,FAMISANAR,820003524.0,EMPRESA SOCIAL DEL ESTADO CENTRO DE SALUD DE TOCA,1081750.0,
EPSS17,FAMISANAR,820003632.0,EMPRESA SOCIAL DEL ESTADO CENTRO DE SALUD SANTANA,1085410.0,
EPSS17,FAMISANAR,820003850.0,EMPRESA SOCIAL DEL ESTADO SANTIAGO DE TUNJA,73651484.0,
EPSS17,FAMISANAR,820004962.0,SERVICIO DE AMBULANCIA INMEDIATO MEDIC S.A.S,22511973.0,
EPSS17,FAMISANAR,820005389.0,EMPRESA SOCIAL DEL ESTADO HOSPITAL REGIONAL DE CHIQUINQUIRA,221729293.0,
EPSS17,FAMISANAR,821003143.0,E.S.E. HOSPITAL DEPARTAMENTAL CENTENARIO DE SEVILLA EMPRESA SOCIAL DEL ESTADO (SEDE 0001),1280048.0,
EPSS17,FAMISANAR,822000946.0,MEDICINA NUCLEAR DIAGNOSTICA S.A.S.,17060510.0,
EPSS17,FAMISANAR,822002459.0,EMPRESA SOCIAL DEL ESTADO DEL MUNICIPIO DE VILLAVICENCIO,26215662.0,
EPSS17,FAMISANAR,822006595.0,"EMPRESA SOCIAL DEL ESTADO DEL DEPARTAMENTO DEL META ESE ""SOLUCION SALUD""",19269640.0,
EPSS17,FAMISANAR,822007351.0,CENTRO OFTALMOLOGICO DEL LLANO S.A.,22912188.0,
EPSS17,FAMISANAR,822007837.0,AMBULANCIAS DEL LLANO SAS,11796688.0,
EPSS17,FAMISANAR,823002991.0,CLINICA SALUD SOCIAL S.A.S,16495064.0,
EPSS17,FAMISANAR,824000426.0,ESE HOSPITAL LOCAL CURUMANI CRISTIAN MORENO PALLARES,2639984.0,
EPSS17,FAMISANAR,824000586.0,ESE HOSPITAL LOCAL LAZARO ALFONSO HERNANDEZ LARA,1309170.0,
EPSS17,FAMISANAR,824000725.0,EMPRESA SOCIAL DEL ESTADO HOSPITAL EDUARDO ARREDONDO DAZA,12362708.0,
EPSS17,FAMISANAR,824000785.0,ESE HOSPITAL LOCAL DE AGUACHICA,1183980.0,
EPSS17,FAMISANAR,824001252.0,CLINICA ERASMO LTDA,5060331.0,
EPSS17,FAMISANAR,824002277.0,CLINICA BUENOS AIRES S.A:S,56760991.0,
EPSS17,FAMISANAR,824002672.0,ESE HOSPITAL CAMILO VILLAZON PUMAREJO,1547576.0,
EPSS17,FAMISANAR,824003102.0,CENTRAL DE PATOLOGIA DEL CESAR LTDA,11803242.0,
EPSS17,FAMISANAR,824003994.0,CENTRO INTEGRAL DE OTORRINOLARINGOLOGIA DOCTOR LUIS ANGEL RODRIGUEZ BOLAÑO SAS,10451576.0,
EPSS17,FAMISANAR,824004330.0,MEDICINA NUCLEAR SA,23233758.0,
EPSS17,FAMISANAR,824005216.0,SOCIEDAD DE UROLOGIA CESAR S. A.S,21424822.0,
EPSS17,FAMISANAR,824005588.0,LABORATORIOS NANCY FLOREZ GARCIA S.A.S,6927593.0,
EPSS17,FAMISANAR,824005609.0,ASISTENCIA MEDICA INMEDIATA AMEDI S.A.S.,118515605.0,
EPSS17,FAMISANAR,824005694.0,CENTRO REGIONAL DE ONCOLOGIA SAS,9936959.0,
EPSS17,FAMISANAR,824006352.0,OFTALMOLOGOS ASOCIADOS S.A.S.,82731747.0,
EPSS17,FAMISANAR,824006480.0,IMAGEN RADIOLOGICA DIAGNOSTICA S.A.S,3309600.0,
EPSS17,FAMISANAR,826000261.0,SERVICIOS INTEGRALES DE REHABILITACION EN BOYACA LIMITADA - SIREB LTDA.,86628039.0,
EPSS17,FAMISANAR,826002060.0,ESE CENTRO DE SALUD SAN ANTONIO DE SOCOTÁ,2295760.0,
EPSS17,FAMISANAR,828000386.0,ESE HOSPITAL MALVINAS HECTOR OROZCO OROZCO,2397900.0,
EPSS17,FAMISANAR,828002586.0,CLINICA CHAIRA IPS,3147102.0,
EPSS17,FAMISANAR,829000940.0,E.S.E. HOSPITAL LOCAL SAN PABLO,1368328.0,
EPSS17,FAMISANAR,829001256.0,ESE HOSPITAL MANUEL ELKIN PATARROYO,4240315.0,
EPSS17,FAMISANAR,829001846.0,EMPRESA SOCIAL DEL ESTADO BARRANCABERMEJA,42128947.0,
EPSS17,FAMISANAR,830009112.0,ORGANIZACIONES DE IMAGENOLOGIA COLOMBIANA OIC SA,23834558.0,
EPSS17,FAMISANAR,830023819.0,LOGISTICA PARA DISPOSITIVOS MEDICOS SAS,23551354.0,
EPSS17,FAMISANAR,830027158.0,RIESGO DE FRACTURA S.A. CAYRE,15739400.0,
EPSS17,FAMISANAR,830053297.0,INSTITUTO OFTALMOLOGICO SALAMANCA S.A IOSAL,154594159.0,
EPSS17,FAMISANAR,830053755.0,MEDINISTROS SAS,96945616.0,
EPSS17,FAMISANAR,830058292.0,UROBOSQUE S.A,199390862.0,
EPSS17,FAMISANAR,830064212.0,UMAF LIMITADA,13970775.0,
EPSS17,FAMISANAR,830070284.0,RESONANCIA MAGNETICA DEL COUNTRY S.A.,78362455.0,
EPSS17,FAMISANAR,830074717.0,FUNDACION AMAR,63519990.0,
EPSS17,FAMISANAR,830100595.0,CENTRO DE INVESTIGACIONES DEL SISTEMA NERVIOSO S.A.S. SIGLA GRUPO CISNE S.A.S.,108228500.0,
EPSS17,FAMISANAR,830108095.0,FUNDACION SUEÑO VIGILIA COLOMBIANA FUNDASUVICOL,19442346.0,
EPSS17,FAMISANAR,830110098.0,FUNDACION CENTRO DE PSICOLOGIA CLINICA Y DE FAMILIA ANITA,5287800.0,
EPSS17,FAMISANAR,830111502.0,FUNDACION CEPYTIN,5005616.0,
EPSS17,FAMISANAR,830123731.0,FUNDACIÓN RENAL DE COLOMBIA,106178544.0,
EPSS17,FAMISANAR,830144683.0,MEDYTECH INTERNATIONAL LIMITADA,69444842.0,
EPSS17,FAMISANAR,830504400.0,CENTRO MEDICO VALLE DE ATRIZ E.U.,1674890.0,
EPSS17,FAMISANAR,830510985.0,"UNIDAD DE DIAGNOSTICOS Y TRATAMIENTOS UROLOGICOS S.A. "" UROMED S.A.""",2521343.0,
EPSS17,FAMISANAR,830510991.0,CLÍNICA ESPECIALIZADA LA CONCEPCIÓN S.A.S,24511686.0,
EPSS17,FAMISANAR,830511202.0,SALUD PLENA SAS,1035107.0,
EPSS17,FAMISANAR,830512772.0,SIKUANY S.A.S,5931987.0,
EPSS17,FAMISANAR,830512886.0,DENTISTETIC S.A.S,6074400.0,
EPSS17,FAMISANAR,830514240.0,DIAGNOSTIMED S.A.,18793588.0,
EPSS17,FAMISANAR,830515000.0,UNIDAD RESPIRATORIA RESPIRAR S.A.S,2184750.0,
EPSS17,FAMISANAR,832000029.0,E.S.E. HOSPITAL HILARIO LUGO DE SASAIMA,92154043.0,
EPSS17,FAMISANAR,832001411.0,E.S.E. HOSPITAL SAN RAFAEL DE CAQUEZA,1252775664.0,
EPSS17,FAMISANAR,832001465.0,E.S.E. HOSPITAL SAN ANTONIO DE ANOLAIMA,49842982.0,
EPSS17,FAMISANAR,832001966.0,ESE HOSPITAL SAN JOSE DEL GUAVIARE,12205843.0,
EPSS17,FAMISANAR,832002436.0,ESE HOSPITAL PROFESOR JORGE CAVELIER -I- NIVEL DE ATENCION CAJICA,77153515.0,
EPSS17,FAMISANAR,832004115.0,UNIDAD MEDICA ORLUZ SAS,87134273.0,
EPSS17,FAMISANAR,832007272.0,CENTRO DE SALUD DE FOSCA E.S.E.,25812134.0,
EPSS17,FAMISANAR,832008321.0,EMPRESA SOCIAL DEL ESTADO E.S.E. CENTRO DE SALUD DE TAUSA,22227215.0,
EPSS17,FAMISANAR,832010240.0,E.S.E. CENTRO DE SALUD CUCUNUBA,8000304.0,
EPSS17,FAMISANAR,832010436.0,HOSPITAL MARIA AUXILIADORA EMPRESA SOCIAL DEL ESTADO DEL MUNICIPIO DE MOSQUERA,565402276.0,
EPSS17,FAMISANAR,832011441.0,E.S.E. HOSPITAL NUESTRA SEÑORA DEL ROSARIO SUESCA,78234128.0,
EPSS17,FAMISANAR,837000708.0,INSTITUCION PRESTADORA DE SERVICIOS DE SALUD LOS ANGELES IPS,5800672.0,
EPSS17,FAMISANAR,844001287.0,EMPRESA SOCIAL DEL ESTADO HOSPITAL DE TAURAMENA,1242519.0,
EPSS17,FAMISANAR,844002258.0,CLINICA MEISEL S.A.S.,41544920.0,
EPSS17,FAMISANAR,844003225.0,EMPRESA SOCIAL DEL ESTADO SALUD YOPAL,2982436.0,
EPSS17,FAMISANAR,844004197.0,RED SALUD CASANARE E.S.E.,3811300.0,
EPSS17,FAMISANAR,846000471.0,ESE HOSPITAL SAGRADO CORAZON DE JESUS,2035736.0,
EPSS17,FAMISANAR,860002541.0,CLINICA DE MARLY S.A,104237562.0,
EPSS17,FAMISANAR,860009555.0,E.S.E. HOSPITAL SANTA MATILDE DE MADRID,391868923.0,
EPSS17,FAMISANAR,860010783.0,CONGREGACION DE DOMINICAS DE SANTA CATALINA DE SENA,132620421.0,
EPSS17,FAMISANAR,860015929.0,E.S.E. HOSPITAL SALAZAR VILLETA,268860390.0,
EPSS17,FAMISANAR,860020094.0,ESE HOSPITAL NUESTRA SEÑORA DEL CARMEN DE EL COLEGIO,45486916.0,
EPSS17,FAMISANAR,860020283.0,E.S.E. HOSPITAL SAN JOSE DE GUADUAS,69919791.0,
EPSS17,FAMISANAR,860023878.0,EMPRESA SOCIAL DEL ESTADO HOSPITAL DIVINO SALVADOR DE SOPO,258443955.0,
EPSS17,FAMISANAR,860023999.0,E.S.E. HOSPITAL SAN VICENTE DE PAUL,2431577.0,
EPSS17,FAMISANAR,860024026.0,ESE HOSPITAL SAN VICENTE DE PAUL DE NEMOCON,219595654.0,
EPSS17,FAMISANAR,860024030.0,EMPRESA SOCIAL DEL ESTADO HOSPITAL DIOGENES TRONCOSO DE PUERTO SALGAR,35684210.0,
EPSS17,FAMISANAR,860024766.0,EMPRESA SOCIAL DEL ESTADO REGION DE SALUD CENTRO ORIENTE ALMEIDAS,195467889.0,
EPSS17,FAMISANAR,860028947.0,"CONGREGACIÓN DE HERMANAS FRANCISCANAS MISIONERAS DE MARÍA AUXILIADORA, REGIÓN MISIONERA SANTA MARÍA BERNARDA.",1923359.0,
EPSS17,FAMISANAR,860035447.0,E.S.E. HOSPITAL SAN ANTONIO DE GUATAVITA,367007253.0,
EPSS17,FAMISANAR,860037592.0,EMPRESA SOCIAL DEL ESTADO HOSPITAL SANTA ROSA DE TENJO,110892875.0,
EPSS17,FAMISANAR,860039431.0,FUNDACION PARA LA REHABILITACION DE ALCOHOLICOS Y ADICTOS-FUNDAR,94646160.0,
EPSS17,FAMISANAR,860040094.0,OXIGENOS DE COLOMBIA LTDA PODRA USAR LA SIGLA OXICOL LTDA.,56501804.0,
EPSS17,FAMISANAR,860053761.0,CLINICA DE OJOS (CLINOJOS) S.A. / CLINOJOS S.A.,38552678.0,
EPSS17,FAMISANAR,860060016.0,ESE HOSPITAL SAN FRANCISCO,5004546.0,
EPSS17,FAMISANAR,860066767.0,CENTRO INTEGRAL DE REHABILITACION COLOMBIA - CIREC,35860200.0,
EPSS17,FAMISANAR,860070301.0,CRUZ ROJA COLOMBIANA SECCIONAL CUNDINAMARCA Y BOGOTA,16588022.0,
EPSS17,FAMISANAR,860516579.0,SUPERAR LTDA,52450082.0,
EPSS17,FAMISANAR,881862576.0,EMPRESA SOCIAL DEL ESTADO HOSPITAL SAGRADO CORAZON DE JESUS DE SOCHA,3197310.0,
EPSS17,FAMISANAR,890000400.0,HOSPITAL ROBERTO QUINTERO VILLA ESE MONTENEGRO,2510891.0,
EPSS17,FAMISANAR,890000600.0,EMPRESA SOCIAL DEL ESTADO HOSPITAL LA MISERICORDIA IPS,5194352.0,
EPSS17,FAMISANAR,890000671.0,ESE HOSPITAL SAN VICENTE DE PAUL,1721280.0,
EPSS17,FAMISANAR,890000992.0,EMPRESA SOCIAL DEL ESTADO HOSPITAL MENTAL DE FILANDIA,5664701.0,
EPSS17,FAMISANAR,890101815.0,JOHNSON & JOHNSON DE COLOMBIA SA,9547372.0,
EPSS17,FAMISANAR,890103406.0,ESE HOSPITAL DE PUERTO COLOMBIA,2513898.0,
EPSS17,FAMISANAR,890110705.0,CLINICA DE FRACTURAS CENTRO DE ORTOPEDIA Y TRAUMATOLOGIA S.A,2287052.0,
EPSS17,FAMISANAR,890112801.0,FUNDACIÓN HOSPITAL UNIVERSIDAD DEL NORTE,22913188.0,
EPSS17,FAMISANAR,890113431.0,CEDIUL S.A.,5396000.0,
EPSS17,FAMISANAR,890117677.0,CLINICA MEDIESP S.A.S.,55418518.0,
EPSS17,FAMISANAR,890200500.0,EMPRESA SOCIAL DEL ESTADO HOSPITAL PSIQUIÁTRICO SAN CAMILO,55833263.0,
EPSS17,FAMISANAR,890201578.0,CAJA DE COMPENSACION FAMILIAR COMFENALCO SANTANDER,25418479.0,
EPSS17,FAMISANAR,890202002.0,ESE HOSPITAL SAN JUAN DE DIOS DE BARICHARA,1254158.0,
EPSS17,FAMISANAR,890202024.0,EMPRESA SOCIAL DEL ESTADO HOSPITAL SAN JUAN DE DIOS DE FLORIDABLANCA,11503406.0,
EPSS17,FAMISANAR,890202066.0,ESE HOSPITAL INTEGRADO SAN ROQUE DE CURITI,1049553.0,
EPSS17,FAMISANAR,890203242.0,CLÍNICA GIRON ESE,10173781.0,
EPSS17,FAMISANAR,890203436.0,ESE HOSPITAL SAN JUAN DE DIOS DE LEBRIJA,2195236.0,
EPSS17,FAMISANAR,890204789.0,E.S.E. HOSPITAL INTEGRADO SAN ANTONIO,1631899.0,
EPSS17,FAMISANAR,890204895.0,E.S.E HOSPITAL INTEGRADO SAN JUAN DE CIMITARRA,1424440.0,
EPSS17,FAMISANAR,890205283.0,RADIOLOGICA S.A.S.,1160280.0,
EPSS17,FAMISANAR,890205456.0,ESE HOSPITAL INTEGRADO SAN BERNARDO,10668630.0,
EPSS17,FAMISANAR,890205516.0,E.S.E HOSPITAL INTEGRADO DE LANDAZURI,6351203.0,
EPSS17,FAMISANAR,890206257.0,PATOLOGIA Y CITOLOGIA S.A.S.,8160333.0,
EPSS17,FAMISANAR,890208758.0,CLINICA MATERNO INFANTIL SAN LUIS S.A,9387160.0,
EPSS17,FAMISANAR,890211722.0,CLINICA SAN PABLO SA,40770758.0,
EPSS17,FAMISANAR,890303208.0,CAJA DE COMPENSACIÓN FAMILIAR DEL VALLE DEL CAUCA - COMFAMILIAR ANDI,7547586.0,
EPSS17,FAMISANAR,890306950.0,E.S.E. HOSPITAL PILOTO JAMUNDI EMPRESA SOCIAL DEL ESTADO,8352893.0,
EPSS17,FAMISANAR,890324177.0,FUNDACION VALLE DEL LILI,40748605.0,
EPSS17,FAMISANAR,890399020.0,FUNDACION CLINICA INFANTIL CLUB NOEL,8879562.0,
EPSS17,FAMISANAR,890480135.0,FUNDACION HOSPITAL INFANTIL NAPOLEON FRANCO PAREJA,55417155.0,
EPSS17,FAMISANAR,890501019.0,ESE HOSPITAL SAN JUAN DE DIOS DE PAMPLONA,5902632.0,
EPSS17,FAMISANAR,890501438.0,E.S.E. HOSPITAL EMIRO QUINTERO CAÑIZARES,3861984.0,
EPSS17,FAMISANAR,890680014.0,SANATORIO DE AGUA DE DIOS E.S.E.,175714426.0,
EPSS17,FAMISANAR,890680025.0,E.S.E. HOSPITAL SAN RAFAEL DE FUSAGASUGA,1022027608.0,
EPSS17,FAMISANAR,890680027.0,E.S.E. HOSPITAL PEDRO LEON ALVAREZ DIAZ,537509450.0,
EPSS17,FAMISANAR,890680031.0,E.S.E. HOSPITAL SAN ANTONIO DE ARBELAEZ,120557160.0,
EPSS17,FAMISANAR,890680032.0,EMPRESA SOCIAL DEL ESTADO HOSPITAL SAN FRANCISCO DE VIOTA,85431340.0,
EPSS17,FAMISANAR,890700666.0,HOSPITAL SAN JUAN DE DIOS HONDA EMPRESA SOCIAL DEL ESTADO,151394197.0,
EPSS17,FAMISANAR,890700694.0,HOSPITAL MARIA INMACULADA E.S.E,1306137.0,
EPSS17,FAMISANAR,890700901.0,HOSPITAL SAN VICENTE DE PAUL EMPRESA SOCIAL DEL ESTADO,3452641.0,
EPSS17,FAMISANAR,890700967.0,HOSPITAL SAN JOSE DE ORTEGA,1918420.0,
EPSS17,FAMISANAR,890701010.0,HOSPITAL SANTA BARBARA E.S.E. DE VENADILLO,1157474.0,
EPSS17,FAMISANAR,890701033.0,E.S.E. HOSPITAL SAN RAFAEL DE EL ESPINAL EMPRESA SOCIAL DEL ESTADO,441643802.0,
EPSS17,FAMISANAR,890701300.0,HOSPITAL SAN CARLOS ESE SALDAÑA TOLIMA,1672451.0,
EPSS17,FAMISANAR,890701353.0,NUEVO HOSPITAL LA CANDELARIA,4439203.0,
EPSS17,FAMISANAR,890701715.0,E.S.E. HOSPITAL SAN ANTONIO,16951664.0,
EPSS17,FAMISANAR,890701718.0,HOSPITAL REGIONAL ALFONSO JARAMILLO SALAZAR EMPRESA SOCIAL DEL ESTADO,23389857.0,
EPSS17,FAMISANAR,890701922.0,HOSPITAL LA MISERICORDIA E.S.E,2077397.0,
EPSS17,FAMISANAR,890702080.0,HOSPITAL FEDERICO ARBELAEZ EMPRESA SOCIAL DEL ESTADO,1717066.0,
EPSS17,FAMISANAR,890702190.0,HOSPITAL SUMAPAZ E.S.E.,3133490.0,
EPSS17,FAMISANAR,890702369.0,E.S.E. CENTRAL DE URGENCIAS LOUIS PASTEUR,65855629.0,
EPSS17,FAMISANAR,890702408.0,HOSPITAL SAN ANTONIO E.S.E DE AMBALEMA,1647703.0,
EPSS17,FAMISANAR,890702476.0,HOSPITAL LA MILAGROSA EMPRESA SOCIAL DEL ESTADO,4869015.0,
EPSS17,FAMISANAR,890703266.0,HOSPITAL NUESTRA SEÑORA DE LOURDES E.S.E.,2963756.0,
EPSS17,FAMISANAR,890704495.0,HOSPITAL SAN ROQUE EMPRESA SOCIAL DEL ESTADO NIVEL I,2102230.0,
EPSS17,FAMISANAR,890706067.0,HOSPITAL SAN JOSÉ,78927710.0,
EPSS17,FAMISANAR,890801099.0,ESE HOSPITAL DEPARTAMENTAL UNIVERSITARIO SANTA SOFIA DE CALDAS,19411736.0,
EPSS17,FAMISANAR,890801201.0,CRUZ ROJA COLOMBIANA SECCIONAL CALDAS,33115795.0,
EPSS17,FAMISANAR,890801495.0,CLINICA PSIQUIATRICA SAN JUAN DE DIOS,53458896.0,
EPSS17,FAMISANAR,890802036.0,E.S.E. HOSPITAL SAN MARCOS,1410957.0,
EPSS17,FAMISANAR,890805923.0,INSTITUTO OFTALMOLOGICO DE CALDAS S.A.,14667356.0,
EPSS17,FAMISANAR,890807591.0,SERVICIOS ESPECIALES DE SALUD-SES HOSPITAL UNIVERSITARIO DE CALDAS,15859403.0,
EPSS17,FAMISANAR,890900518.0,FUNDACION HOSPITALARIA SAN VICENTE DE PAUL,30891513.0,
EPSS17,FAMISANAR,890903777.0,SOCIEDAD MEDICA ANTIOQUEÑA S.A. SOMA,3294937.0,
EPSS17,FAMISANAR,890905166.0,"E.S.E. HOSPITAL MENTAL DE ANTIOQUIA ""MARÍA UPEGUI - HOMO""",5021491.0,
