EPSS41,NUEVA EPS,900248882.0,CLINICA PORTOAZUL S.A SIGLA CPA,132000000.0,
EPSS41,NUEVA EPS,900254233.0,VIHONCO IPS BUCARAMANGA,282200000.0,
EPSS41,NUEVA EPS,900256612.0,FUNDACION ESPECIALIZADA EN DESARROLLO INFANTIL - FEDI,2298240.0,
EPSS41,NUEVA EPS,900263426.0,CENTRO ESPECIALIZADO DE ALTA TECNOLOGIA EN IMÁGENES DIAGNOSTICAS SAS,14850000.0,
EPSS41,NUEVA EPS,900267064.0,INVERSIONES AZALUD S.A.S,1194491.0,
EPSS41,NUEVA EPS,900272320.0,"CIA DE NEUROLOGOS.NEUROCIRUJANOS Y ESPECIALIDADES AFINES, SOCIEDAD ACCIONES SIMPLIF CONEURO S.A.S.",40784940.0,
EPSS41,NUEVA EPS,900272582.0,CLINICA SAN JUAN BAUTISTA S.A.S.,125732603.0,
EPSS41,NUEVA EPS,900275974.0,"INSTITUTO PARA LA PREVENCIÓN, EL TRATAMIENTO Y REHABILITACIÓN DE LAS ENFERMEDADES INMUNOSUPRESORAS SAS - RENACERA",1044000000.0,
EPSS41,NUEVA EPS,900277630.0,CLINICA MARYBAU LA LOMA LTDA,8700485.0,
EPSS41,NUEVA EPS,900278642.0,AMBULANCIAS SANTA RITA S.A.S,21925280.0,
EPSS41,NUEVA EPS,900279506.0,CENTRO CARDIOVASCULAR LUNA PACINI S.A.S,1600164.0,
EPSS41,NUEVA EPS,900294794.0,COMITE DE ESTUDIOS MEDICOS S.A.S,33463287.0,
EPSS41,NUEVA EPS,900307987.0,VITAL MEDICAL CARE VIMEC S.A.S,69555014.0,
EPSS41,NUEVA EPS,900308007.0,PASSUS IPS TALLER PSICOMOTRIZ S.A.S,42284550.0,
EPSS41,NUEVA EPS,900311715.0,VIHONCO IPS COSTA SAS,186850000.0,
EPSS41,NUEVA EPS,900320195.0,GASTROMEDIC S.A.S.,25488264.0,
EPSS41,NUEVA EPS,900342064.0,SOCIEDAD COMERCIALIZADORA DE INSUMOS Y SERVICIOS MÉDICOS S.A.S,55825996.0,
EPSS41,NUEVA EPS,900343773.0,CENTRO OFTALMOLOGICO LYND NEWBALL,9865277.0,
EPSS41,NUEVA EPS,900345765.0,EMPRESA MULTIACTIVA DE SALUD,53851216.0,
EPSS41,NUEVA EPS,900351018.0,FISIOHOMESAS,11569043.0,
EPSS41,NUEVA EPS,900355585.0,RAYOS X DEL HUILA S.A.S,20331523.0,
EPSS41,NUEVA EPS,900358922.0,HABILITAR DEL CARIBE S.A.S,60200000.0,
EPSS41,NUEVA EPS,900367824.0,TU BOCA BELLA S.A.S,9776581.0,
EPSS41,NUEVA EPS,900377863.0,UNION DE CIRUJANOS S.A.S.,7721022.0,
EPSS41,NUEVA EPS,900382319.0,AMBULANCIAS SAN JOSE S.A.S,39420000.0,
EPSS41,NUEVA EPS,900386591.0,GYO MEDICAL I.P.S. S.A.S.,215826836.0,
EPSS41,NUEVA EPS,900390423.0,PROMOTORA CLINICA ZONA FRANCA DE URABA SAS,502615614.0,
EPSS41,NUEVA EPS,900400605.0,UNIDAD DE PERINATOLOGIA Y TERAPIA FETAL DEL CARIBE SAS,107715026.0,
EPSS41,NUEVA EPS,900405505.0,SERVICIOS MEDICOS FAMEDIC SAS,41540000.0,
EPSS41,NUEVA EPS,900415353.0,SERVICIO DE EMERGENCIAS MEDICAS DEL CAQUETA S.A.S,1680000.0,
EPSS41,NUEVA EPS,900422064.0,CENTRO ESPECIALIZADO DE UROLOGIA S.A.S,58500000.0,
EPSS41,NUEVA EPS,900431550.0,CLINICA LA VICTORIA S.A.S.,3680000.0,
EPSS41,NUEVA EPS,900438572.0,CENTRO TERAPEUTICO RE-ENCONTRARSE S.A.S.,76000000.0,
EPSS41,NUEVA EPS,900470642.0,MEDICAL DUARTE ZF S.A.S,2864950334.0,
EPSS41,NUEVA EPS,900483518.0,HUMANIZAR SALUD INTEGRAL S.A.S.,58062117.0,
EPSS41,NUEVA EPS,900483953.0,UNIDAD MOVIL DE EMERGENCIAS MEDICAS VITALES S.A.S,50000000.0,
EPSS41,NUEVA EPS,900484594.0,CENTRO DE REHABILITACIÓN SONRISAS DEL GUAVIARE IPS S.A.S.,6542235.0,
EPSS41,NUEVA EPS,900500653.0,CAD VIDA IPS S.A.S,84554400.0,
EPSS41,NUEVA EPS,900512334.0,TRANSACUATICO K & M S.A.S,190588421.0,
EPSS41,NUEVA EPS,900518251.0,S.A.E. SERVICIOS AEREOS ESPECIALES GLOBAL LIFE AMBULANCIAS S.A.S,791650000.0,
EPSS41,NUEVA EPS,900520293.0,"FUNDACIÓN UNIONVIDA ""FUNVIDA""",462000000.0,
EPSS41,NUEVA EPS,900520501.0,TOLIMEDICA SAS,7110000.0,
EPSS41,NUEVA EPS,900520772.0,ARMONY CLÍNICA DE ESPECIALISTAS Y CIRUGÍA S.A.S,14452091.0,
EPSS41,NUEVA EPS,900529056.0,MEDIFACA IPS S.A.S,3604930.0,
EPSS41,NUEVA EPS,900532504.0,DAVITA S.A.S.,1290560000.0,
EPSS41,NUEVA EPS,900547909.0,CENTRO DE ORTOPEDIA Y REHABILITACION ORTOVITAL INTEGRAL S.A.S.,30477500.0,
EPSS41,NUEVA EPS,900565233.0,LIFE CARE AMBULANCIAS S.A.S,16489437.0,
EPSS41,NUEVA EPS,900573146.0,PRIUS SAS,110276123.0,
EPSS41,NUEVA EPS,900577446.0,MEDIALCO ZONA FRANCA S.A.S,21409884.0,
EPSS41,NUEVA EPS,900578105.0,CORPORACIÓN SALUD UN,197465994.0,
EPSS41,NUEVA EPS,900589178.0,REMY IPS S.A.S,29721564.0,
EPSS41,NUEVA EPS,900601052.0,UNIDAD PEDIÁTRICA SIMÓN BOLÍVAR IPS SAS,3530181.0,
EPSS41,NUEVA EPS,900606427.0,UNIDAD OFTALMOLÓGICA DE ALTA TECNOLOGÍA S.A.S.,9872039.0,
EPSS41,NUEVA EPS,900614113.0,VITALMEDIC&ASOCIADOS SAS,24752131.0,
EPSS41,NUEVA EPS,900617997.0,VIVESSALUD EJE CAFETERO S.A.S.,54880000.0,
EPSS41,NUEVA EPS,900622320.0,GASTROKIDS SAS,1796000.0,
EPSS41,NUEVA EPS,900625317.0,CORPORACIÓN HOSPITAL INFANTIL CONCEJO DE MEDELLÍN,3150000.0,
EPSS41,NUEVA EPS,900680974.0,NEUMOVIDA S.A.S.,1100666.0,
EPSS41,NUEVA EPS,900685351.0,SALUD A SU HOGAR DE COLOMBIA IPS SAS,1499712.0,
EPSS41,NUEVA EPS,900691301.0,DIAXME S.A.S,61440000.0,
EPSS41,NUEVA EPS,900699086.0,CLINICA PALMA REAL S.A.S,95774536.0,
EPSS41,NUEVA EPS,900702981.0,CLINICA CENTENARIO S.A.S,724429094.0,
EPSS41,NUEVA EPS,900705451.0,FUNDACION CRISTIANA LAZOS DE AMOR,74887953.0,
EPSS41,NUEVA EPS,900718172.0,CLINICA INTERNACIONAL DE ALTA TECNOLOGIA CLINALTEC S.A.S.,584098005.0,
EPSS41,NUEVA EPS,900743259.0,OFTALMOLOGIA DE ALTA TECNOLOGÍA SAS,1702161.0,
EPSS41,NUEVA EPS,900743605.0,RHOCAMPO S.A.S.,20583110.0,
EPSS41,NUEVA EPS,900744042.0,MEDICPLUS SAS,500665007.0,
EPSS41,NUEVA EPS,900759182.0,FUNDACIÓN DE PROYECTO HOMBRE DE BIEN,150926836.0,
EPSS41,NUEVA EPS,900767863.0,CENTRO MEDICO GUAVIARE CMG S.A.S,6800186.0,
EPSS41,NUEVA EPS,900769055.0,SERVICIO INTEGRAL DE MEDICINA AMBULATORIA - SIMA.LINK S.A.S,23803650.0,
EPSS41,NUEVA EPS,900785142.0,MOVIL VIDA SAS,231778730.0,
EPSS41,NUEVA EPS,900807126.0,CLINICA REINA ISABEL SAS,105716123.0,
EPSS41,NUEVA EPS,900807482.0,EMPRESA SOCIAL DEL ESTADO HOSPITAL DE LA VEGA,9644579.0,
EPSS41,NUEVA EPS,900826841.0,MEDICINA Y TERAPIAS DOMICILIARIAS S.A.S.,160269988.0,
EPSS41,NUEVA EPS,900827925.0,GRUPO SAMI SALUD SAS,1568000.0,
EPSS41,NUEVA EPS,900830994.0,ALVIHOUSE I.P.S S.A.S.,26342400.0,
EPSS41,NUEVA EPS,900839714.0,PROFHARMA SALUD IPS S.A.S,100000000.0,
EPSS41,NUEVA EPS,900843572.0,CENTRO DE REHABILITACION INTEGRAL DEL ARIARI,16307200.0,
EPSS41,NUEVA EPS,900853712.0,IPS UNIDAD RENAL DEL SARARE SAS,325918941.0,
EPSS41,NUEVA EPS,900862842.0,CENTRO DE OTORRINOLARINGOLOGIA Y FONOAUDIOLOGIA DE LA SABANA S.A.S,2482254.0,
EPSS41,NUEVA EPS,900886925.0,IPS MECAS SALUD DOMICILIARIA SAS,89255839.0,
EPSS41,NUEVA EPS,900900122.0,HEALTH & LIFE IPS SAS SIGLA H&L UCC SAS,166183768.0,
EPSS41,NUEVA EPS,901014934.0,IPS NUEVO AMAZONAS S.A.S,19685940.0,
EPSS41,NUEVA EPS,901064210.0,CENTRO NEUMOLOGICO DEL NORTE SAS,3108173.0,
EPSS41,NUEVA EPS,901085352.0,INSTITUTO MEDICO DE ALTA TECNOLOGÍA S.A.S,2306407662.0,
EPSS41,NUEVA EPS,901088611.0,UNIDAD DE SALUD MENTAL DE ARAUCA LTDA,72608527.0,
EPSS41,NUEVA EPS,901129333.0,INSTITUTO DE SISTEMA NERVIOSO DE CORDOBA,110662735.0,
EPSS41,NUEVA EPS,901201887.0,HOSPITAL DE ALTA COMPLEJIDAD DEL PUTUMAYO S.A.S ZOMAC,362082852.0,
EPSS41,NUEVA EPS,901203508.0,CL AMBULANCIAS SAS,28267057.0,
EPSS41,NUEVA EPS,901220332.0,COCHLEAR COLOMBIA SAS,45023501.0,
EPSS41,NUEVA EPS,901313049.0,RED SALUD INTEGRAL IPS S.A.S.,1545000.0,
EPSS41,NUEVA EPS,901326019.0,CLINICA DE URGENCIAS DE SALUD MENTAL SAN LUCAS SAS,70000000.0,
EPSS41,NUEVA EPS,901341454.0,INTTEGRAL I.P.S S.A.S,1381661.0,
EPSS41,NUEVA EPS,901352353.0,CLINICA LA SAGRADA FAMILIA SAS,391369785.0,
EPSS41,NUEVA EPS,901383010.0,UCIS DE COLOMBIA S.A.S.,3000000000.0,
EPSS41,NUEVA EPS,901536799.0,EMPRESA SOCIAL DEL ESTADO UNIVERSITARIA DEL ATLANTICO,350603693.0,
EPSS42,COOSALUD,800014405.0,ESE HOSPITAL SANTA ISABEL,2707819.0,
EPSS42,COOSALUD,800014884.0,ESE HOSPITAL HÉCTOR ABAD GÓMEZ,1147644.0,
EPSS42,COOSALUD,800026173.0,ESE HOSPITAL HELI MORENO BLANCO,10168271.0,
EPSS42,COOSALUD,800037021.0,HOSPITAL DEPARTAMENTAL DE GRANADA - EMPRESA SOCIAL DEL META,4870045.0,
EPSS42,COOSALUD,800037244.0,E.S.E. HOSPITAL GUILLERMO GAVIRIA CORREA,2386690.0,
EPSS42,COOSALUD,800037979.0,E.S.E. HOSPITAL LOCAL DE PUERTO LOPEZ,3248813.0,
EPSS42,COOSALUD,800075650.0,EMPRESA SOCIAL DEL ESTADO HOSPITAL SANTO TOMAS,10009110.0,
EPSS42,COOSALUD,800114286.0,E.S.E. HOSPITAL SAN CAMILO DE LELIS,2947280.0,
EPSS42,COOSALUD,800125697.0,E.S.E. HOSPITAL NELSON RESTREPO MARTINEZ,2185108.0,
EPSS42,COOSALUD,800138968.0,EMPRESA SOCIAL DEL ESTADO HOSPITAL LA ESTRELLA,1606067.0,
EPSS42,COOSALUD,800143438.0,E.S.E. HOSPITAL HECTOR ABAD GOMEZ,1469014.0,
EPSS42,COOSALUD,800150497.0,ESE HOSPITAL FRANCISCO CANOSSA,3045992.0,
EPSS42,COOSALUD,800179870.0,HOSPITAL SAN ANDRES E.S.E.,20217344.0,
EPSS42,COOSALUD,800213942.0,E.S.E. HOSPITAL SANTA CRUZ,1383330.0,
EPSS42,COOSALUD,804005555.0,E.S.E. HOSPITAL SANTO DOMINGO SAVIO,14164862.0,
EPSS42,COOSALUD,804005695.0,ESE. SAN ISIDRO DEL MUNICIPIO DE TONA,2185804.0,
EPSS42,COOSALUD,806007809.0,E.S.E. HOSPITAL LOCAL MANUELA PABUENA LOBO,1744326.0,
EPSS42,COOSALUD,809005719.0,HOSPITAL SAN VICENTE E.S.E,1658450.0,
EPSS42,COOSALUD,810001392.0,ESE HOSPITAL DEPARTAMENTAL SAN ANTONIO DE MARMATO,2604735.0,
EPSS42,COOSALUD,812002993.0,E.S.E CAMU IRIS LÓPEZ DURAN,1101810.0,
EPSS42,COOSALUD,813002940.0,EMPRESA SOCIAL DEL ESTADO MARIA AUXILIADORA DE GARZON,1139699.0,
EPSS42,COOSALUD,820003787.0,EMPRESA SOCIAL DEL ESTADO CENTRO DE SALUD BRICEÑO,1367200.0,
EPSS42,COOSALUD,821000831.0,EMPRESA SOCIAL DEL ESTADO HOSPITAL RUBEN CRUZ VELEZ,2210816.0,
EPSS42,COOSALUD,822006595.0,"EMPRESA SOCIAL DEL ESTADO DEL DEPARTAMENTO DEL META ESE ""SOLUCION SALUD""",2781884.0,
EPSS42,COOSALUD,823002149.0,CENTRO DE SALUD SANTA LUCIA E.S.E.,5028708.0,
EPSS42,COOSALUD,824000425.0,ESE HOSPITAL SAN JOSE,36520863.0,
EPSS42,COOSALUD,824000441.0,HOSPITAL LOCAL ALVARO RAMIREZ GONZALEZ E.S.E,12447257.0,
EPSS42,COOSALUD,824000462.0,ESE HOSPITAL JOSE ANTONIO SOCARRAS,4016582.0,
EPSS42,COOSALUD,824000472.0,ESE HOSPITAL SAN JUAN CRISOSTOMO,1106004.0,
EPSS42,COOSALUD,824000785.0,ESE HOSPITAL LOCAL DE AGUACHICA,2657293.0,
EPSS42,COOSALUD,824002672.0,ESE HOSPITAL CAMILO VILLAZON PUMAREJO,5252372.0,
EPSS42,COOSALUD,825000620.0,ESE HOSPITAL NUESTRA SEÑORA DEL CARMEN,3624807.0,
EPSS42,COOSALUD,825000834.0,EMPRESA SOCIAL DEL ESTADO HOSPITAL SANTA RITA DE CASSIA,3595752.0,
EPSS42,COOSALUD,825002525.0,ESE HOSPITAL SAN RAFAEL DE ALBANIA,3047000.0,
EPSS42,COOSALUD,829000940.0,E.S.E. HOSPITAL LOCAL SAN PABLO,13251508.0,
EPSS42,COOSALUD,829003945.0,ESE CENTRO DE SALUD PUERTO PARRA,1608444.0,
EPSS42,COOSALUD,832001411.0,E.S.E. HOSPITAL SAN RAFAEL DE CAQUEZA,4149827.0,
EPSS42,COOSALUD,838000096.0,E.S.E. HOSPITAL SAN RAFAEL DE LETICIA,4337047.0,
EPSS42,COOSALUD,846000253.0,EMPRESA SOCIAL DEL ESTADO HOSPITAL LOCAL,19520364.0,
EPSS42,COOSALUD,846002309.0,ESE HOSPITAL FRONTERIZO LA DORADA,1317416.0,
EPSS42,COOSALUD,860009555.0,E.S.E. HOSPITAL SANTA MATILDE DE MADRID,4733736.0,
EPSS42,COOSALUD,860020094.0,ESE HOSPITAL NUESTRA SEÑORA DEL CARMEN DE EL COLEGIO,5540322.0,
EPSS42,COOSALUD,860023878.0,EMPRESA SOCIAL DEL ESTADO HOSPITAL DIVINO SALVADOR DE SOPO,8544446.0,
EPSS42,COOSALUD,860024030.0,EMPRESA SOCIAL DEL ESTADO HOSPITAL DIOGENES TRONCOSO DE PUERTO SALGAR,1322280.0,
EPSS42,COOSALUD,860037592.0,EMPRESA SOCIAL DEL ESTADO HOSPITAL SANTA ROSA DE TENJO,4015138.0,
EPSS42,COOSALUD,860060016.0,ESE HOSPITAL SAN FRANCISCO,1332660.0,
EPSS42,COOSALUD,890000905.0,EMPRESA SOCIAL DEL ESTADO HOSPITAL PIO X DEL MUNICIPIO DE LA TEBAIDA QUINDIO,3064995.0,
EPSS42,COOSALUD,890001006.0,ESE HOSPITAL SAGRADO CORAZON DE JESUS DE QUIMBAYA,1213300.0,
EPSS42,COOSALUD,890103406.0,ESE HOSPITAL DE PUERTO COLOMBIA,17637260.0,
EPSS42,COOSALUD,890205516.0,E.S.E HOSPITAL INTEGRADO DE LANDAZURI,14649978.0,
EPSS42,COOSALUD,890309115.0,E.S.E. HOSPITAL LOCAL YOTOCO EMPRESA SOCIAL DEL ESTADO,1489511.0,
EPSS42,COOSALUD,890312380.0,ESE HOSPITAL SAN JORGE,2637435.0,
EPSS42,COOSALUD,890480113.0,HOSPITAL REGIONAL NUESTRA SEÑORA DE LAS MERCEDES DE COROZAL E.S.E.,70055165.0,
EPSS42,COOSALUD,890700666.0,HOSPITAL SAN JUAN DE DIOS HONDA EMPRESA SOCIAL DEL ESTADO,17601097.0,
EPSS42,COOSALUD,890700694.0,HOSPITAL MARIA INMACULADA E.S.E,1384821.0,
EPSS42,COOSALUD,890701033.0,E.S.E. HOSPITAL SAN RAFAEL DE EL ESPINAL EMPRESA SOCIAL DEL ESTADO,31603174.0,
EPSS42,COOSALUD,890702241.0,HOSPITAL NUESTRA SEÑORA DEL CARMEN EMPRESA SOCIAL DEL ESTADO,1161904.0,
EPSS42,COOSALUD,890702369.0,E.S.E. CENTRAL DE URGENCIAS LOUIS PASTEUR,12152722.0,
EPSS42,COOSALUD,890706067.0,HOSPITAL SAN JOSÉ,4621100.0,
EPSS42,COOSALUD,890706823.0,HOSPITAL REINA SOFIA DE ESPAÑA EMPRESA SOCIAL DEL ESTADO LERIDA TOLIMA,3223951.0,
EPSS42,COOSALUD,890801026.0,E.S.E. HOSPITAL DEPARTAMENTAL FELIPE SUAREZ,1153577.0,
EPSS42,COOSALUD,890801517.0,E.S.E. HOSPITAL SANTA TERESITA,1582911.0,
EPSS42,COOSALUD,890801562.0,ESE HOSPITAL DEPARTAMENTAL SAN JOSE DE NEIRA,1170902.0,
EPSS42,COOSALUD,890801758.0,E.S.E. HOSPITAL SAN LORENZO DE SUPÍA,2243983.0,
EPSS42,COOSALUD,890802961.0,ESE HOSPITAL SAN JOSE DE SAMANA,1525183.0,
EPSS42,COOSALUD,890802978.0,E.S.E. HOSPITAL SAN JOSE,3383216.0,
EPSS42,COOSALUD,890905193.0,ESE HOSPITAL SAN VICENTE DE PAUL,1973460.0,
EPSS42,COOSALUD,890906211.0,E.S.E. HOSPITAL MUNICIPAL SAN ROQUE,3157766.0,
EPSS42,COOSALUD,890906347.0,ESE HOSPITAL MANUEL URIBE ANGEL,200000000.0,
EPSS42,COOSALUD,890907254.0,HOSPITAL SAN JUAN DE DIOS E.S.E RIONEGRO - ANTIOQUIA,19607962.0,
EPSS42,COOSALUD,890980003.0,EMPRESA SOCIAL DEL ESTADO SAN JUAN DE DIOS,5196805.0,
EPSS42,COOSALUD,890980326.0,HOSPITAL SAN JUAN DE DIOS EL SANTUARIO,1984040.0,
EPSS42,COOSALUD,890980346.0,E.S.E. HOSPITAL SAN JUAN DE DIOS DE TITIRIBÍ,2053699.0,
EPSS42,COOSALUD,890980444.0,EMPRESA SOCIAL DEL ESTADO HOSPITAL SAN ANTONIO,2021028.0,
EPSS42,COOSALUD,890980727.0,E.S.E. HOSPITAL SAN RAFAEL,2837550.0,
EPSS42,COOSALUD,890980752.0,E.S.E. SAN JUAN DE DIOS DE MARINILLA,4569952.0,
EPSS42,COOSALUD,890980814.0,EMPRESA SOCIAL DEL ESTADO HOSPITAL SAN RAFAEL,3895490.0,
EPSS42,COOSALUD,890980840.0,ESE HOSPITAL SAN JUAN DE DIOS,1517914.0,
EPSS42,COOSALUD,890980949.0,ESE HOSPITAL SANTA MARGARITA,1791640.0,
EPSS42,COOSALUD,890981108.0,ESE HOSPITAL SAN JUAN DE DIOS DE COCORNA,3189353.0,
EPSS42,COOSALUD,890981266.0,E.S.E. HOSPITAL SAN PIO X,2500517.0,
EPSS42,COOSALUD,890981424.0,E.S.E. HOSPITAL SAN JOSE,3534925.0,
EPSS42,COOSALUD,890981690.0,E.S.E. NUESTRA SEÑORA DE GUADALUPE,7034618.0,
EPSS42,COOSALUD,890981719.0,E.S.E. NUETRA SEÑORA DE LA CANDELARIA,1136790.0,
EPSS42,COOSALUD,890981848.0,E.S.E. HOSPITAL SAN LUIS BELTRAN,1097426.0,
EPSS42,COOSALUD,890982091.0,E.S.E. HOSPITAL SAN RAFAEL DE SAN LUIS,1133739.0,
EPSS42,COOSALUD,890982113.0,EMPRESA SOCIAL DEL ESTADO HOSPITAL GUSTAVO GONZALEZ OCHOA,3074169.0,
EPSS42,COOSALUD,890982134.0,E.S.E. HOSPITAL PEDRO NEL CARDONA,6006689.0,
EPSS42,COOSALUD,890984779.0,ESE HOSPITAL PRESBITERO EMIGDIO PALACIO,1897233.0,
EPSS42,COOSALUD,890985810.0,EMPRESA SOCIAL DEL ESTADO HOSPITAL OCTAVIO OLIVARES,2513666.0,
EPSS42,COOSALUD,891180026.0,E.S.E. HOSPITAL DEPARTAMENTAL SAN VICENTE DE PAUL DE GARZON,33241315.0,
EPSS42,COOSALUD,891200209.0,FUNDACION HOSPITAL SAN PEDRO,9805953.0,
EPSS42,COOSALUD,891200445.0,E.S.E. HOSPITAL SAN ANTONIO DE BARBACOAS,7784726.0,
EPSS42,COOSALUD,891200528.0,E.S.E. HOSPITAL UNIVERSITARIO DEPARTAMENTAL DE NARIÑO,83903118.0,
EPSS42,COOSALUD,891401777.0,EMPRESA SOCIAL DEL ESTADO HOSPITAL SAN VICENTE DE PAUL SANTUARIO,2880386.0,
EPSS42,COOSALUD,891408918.0,EMPRESA SOCIAL DEL ESTADO HOSPITAL SAN JOSE,1590598.0,
EPSS42,COOSALUD,891411665.0,EMPRESA SOCIAL DEL ESTADO HOSPITAL CRISTO REY,1552805.0,
EPSS42,COOSALUD,891500084.0,HOSPITAL FRANCISCO DE PAULA SANTANDER E.S.E. NIVEL II,31783280.0,
EPSS42,COOSALUD,891780185.0,EMPRESA SOCIAL DEL ESTADO HOSPITAL UNIVERSITARIO JULIO MENDEZ BARRENECHE,200000000.0,
EPSS42,COOSALUD,891900356.0,E.S.E. HOSPITAL SANTANDER EMPRESA SOCIAL DEL ESTADO,2400689.0,
EPSS42,COOSALUD,891900390.0,E.S.E. HOSPITAL SAN VICENTE FERRER,1531828.0,
EPSS42,COOSALUD,891900438.0,EMPRESA SOCIAL DEL ESTADO HOSPITAL SAN VICENTE DE PAUL,5848271.0,
EPSS42,COOSALUD,891900446.0,HOSPITAL SANTA ANA DE LOS CABALLEROS - ESE EMPRESA SOCIAL DEL ESTADO,2049754.0,
EPSS42,COOSALUD,891900732.0,E.S.E. HOSPITAL KENNEDY EMPRESA SOCIAL DEL ESTADO,1050210.0,
EPSS42,COOSALUD,891901123.0,E.S.E. HOSPITAL LOCAL SANTA CRUZ EMPRES SOCIAL DEL ESTADO,1518168.0,
EPSS42,COOSALUD,892000264.0,E.S.E. HOSPITAL MUNICIPAL DE ACACIAS,9092892.0,
EPSS42,COOSALUD,892170002.0,ESE HOSPITAL SAN AGUSTIN DE FONSECA,6554089.0,
EPSS42,COOSALUD,892300209.0,ESE HOSPITAL TAMALAMEQUE,1937244.0,
EPSS42,COOSALUD,899999032.0,EMPRESA SOCIAL DEL ESTADO HOSPITAL UNIVERSITARIO DE LA SAMARITANA,200000000.0,
EPSS42,COOSALUD,899999164.0,ESE HOSPITAL NUESTRA SEÑORA DEL CARMEN DE TABIO,5894212.0,
EPSS42,COOSALUD,899999165.0,EMPRESA SOCIAL DEL ESTADO HOSPITAL SAN JOSE,1189288.0,
EPSS42,COOSALUD,900052148.0,CXAYU`CE JXUT EMPRESA SOCIAL DEL ESTADO,1213284.0,
EPSS42,COOSALUD,900142446.0,E.S.E CENTRO DE SALUD DE LOS ANDES,2634519.0,
EPSS42,COOSALUD,900145604.0,ESE DE PRIMER NIVEL DE EL MUNICIPIO DE EL ROSARIO,2848187.0,
EPSS42,COOSALUD,900145767.0,ESE SUR OCCIDENTE,9880725.0,
EPSS42,COOSALUD,900196366.0,E.S.E HOSPITAL SAN ANTONIO DE PADUA,17278324.0,
EPSS42,COOSALUD,900211477.0,E.S.E. RAFAEL TOVAR POVEDA,2445324.0,
EPSS42,COOSALUD,900283194.0,EMPRESA SOCIAL DEL ESTADO CENTRO DE SALUD SAN FRANCISCO DE SALES,1206826.0,
EPSS42,COOSALUD,900412444.0,HOSPITAL ORTOPÉDICO S.A.S,3566175.0,
EPSS42,COOSALUD,900750333.0,EMPRESA SOCIAL DEL ESTADO DEL ORDEN DEPARTAMENTAL HOSPITAL NUESTRA SEÑORA DE LAS MERCEDES DEL MUNICIPIO DE FUNZA,2459922.0,
EPSS48,EPS MUTUAL SER,802021332.0,CLINICA CENTRO S.A,132187104.0,
EPSS48,EPS MUTUAL SER,806015201.0,GESTION SALUD S.A.S.,12735969.0,
EPSS48,EPS MUTUAL SER,816001182.0,AUDIFARMA S.A.,90713977.0,
EPSS48,EPS MUTUAL SER,819002176.0,COMPAÑÍA COLOMBIANA DE SALUD COLSALUD S.A,10496505.0,
EPSS48,EPS MUTUAL SER,890102768.0,ORGANIZACION CLINICA GENERAL DEL NORTE,25991262.0,
EPSS48,EPS MUTUAL SER,890112801.0,FUNDACIÓN HOSPITAL UNIVERSIDAD DEL NORTE,13091614.0,
EPSS48,EPS MUTUAL SER,890480135.0,FUNDACION HOSPITAL INFANTIL NAPOLEON FRANCO PAREJA,11167697.0,
EPSS48,EPS MUTUAL SER,900042103.0,EMPRESA SOCIAL DEL ESTADO HOSPITAL UNIVERSITARIO DEL CARIBE,19104209.0,
EPSS48,EPS MUTUAL SER,900540156.0,FUNDACION CLINICA DEL RIO,14464990.0,
EPSS48,EPS MUTUAL SER,900740827.0,CLINICA UNIVERSITARIA MEDICINA INTEGRAL S.A. - CUMI,22781081.0,
EPSS48,EPS MUTUAL SER,900980728.0,INSTITUCION PRESTADORA DE SERVICIOS DE SALUD CUIDADO SEGURO EN CASA S.A,125645402.0,
EPSS48,EPS MUTUAL SER,901139193.0,MIRED BARRANQUILLA IPS S.A.S.,29517643.0,
EPSS48,EPS MUTUAL SER,901201438.0,HOSPICE IPS S.A.S.,15179697.0,
ESS024,COOSALUD,800000118.0,EMPRESA SOCIAL DEL ESTADO HOSPITAL DEPARTAMENTAL UNIVERSITARIO DEL QUINDIO SAN JUAN DE DIOS,8717878.0,
ESS024,COOSALUD,800006850.0,EMPRESA SOCIAL DEL ESTADO REGION DE SALUD SOACHA,429108076.0,
ESS024,COOSALUD,800014405.0,ESE HOSPITAL SANTA ISABEL,1439167.0,
ESS024,COOSALUD,800030924.0,E.S.E. HOSPITAL LA BUENA ESPERANZA,10083267.0,
ESS024,COOSALUD,800033723.0,SERVICIOS MEDICOS OLIMPUS I.P.S. SOCIEDAD POR ACCIONES SIMPLIFICADA,507715413.0,
ESS024,COOSALUD,800037244.0,E.S.E. HOSPITAL GUILLERMO GAVIRIA CORREA,1075788.0,
ESS024,COOSALUD,800044320.0,EMPRESA SOCIAL DEL ESTADO HOSPITAL EL SAGRADO CORAZON,1002476.0,
ESS024,COOSALUD,800048954.0,CLINICA VERSALLES S.A.,1377027546.0,
ESS024,COOSALUD,800061765.0,ESE HOSPITAL NUESTRA SEÑORA DEL PERPETUO SOCORRO,6833335.0,
ESS024,COOSALUD,800064543.0,E.S.E. HOSPITAL INTEGRADO SABANA DE TORRES,4675988.0,
ESS024,COOSALUD,800065395.0,EMPRESA SOCIAL DEL ESTADO HOSPITAL TOBIAS PUERTA,4401415.0,
ESS024,COOSALUD,800067514.0,COMITÉ MUNICIPAL DE LA CRUZ ROJA DE MAICAO,43958030.0,
ESS024,COOSALUD,800080586.0,ESE HOSPITAL SAN JUAN DE DIOS,23316106.0,
ESS024,COOSALUD,800084206.0,EMPRESA SOCIAL DEL ESTADO INSTITUTO DE SALUD DE BUCARAMANGA,494001903.0,
ESS024,COOSALUD,800099778.0,ASOCIACIÓN NIÑOS DE PAPEL,272198848.0,
ESS024,COOSALUD,800099860.0,E.S.E. HOSPITAL SAN RAFAEL DE PACHO,65020019.0,
ESS024,COOSALUD,800112725.0,FUNDACION OFTALMOLOGICA DEL CARIBE,133180190.0,
ESS024,COOSALUD,800114286.0,E.S.E. HOSPITAL SAN CAMILO DE LELIS,3457089.0,
ESS024,COOSALUD,800119574.0,SOCIEDAD DE SERVICIOS OCULARES S.A.S-OPTISALUD,109943652.0,
ESS024,COOSALUD,800119945.0,HOSPITAL SAN ROQUE ESE,6206335.0,
ESS024,COOSALUD,800130625.0,ESE HOSPITAL SAN CRISTOBAL DE CIENAGA,38795035.0,
ESS024,COOSALUD,800138011.0,ESE HOSPITAL LA MISERICORDIA,17519903.0,
ESS024,COOSALUD,800138311.0,EMPRESA SOCIAL DEL ESTADO HOSPITAL NUESTRA SEÑORA DEL CARMEN,186673027.0,
ESS024,COOSALUD,800152970.0,HOSPITAL REGIONAL DE MIRAFLORES EMPRESA SOCIAL DEL ESTADO,97323949.0,
ESS024,COOSALUD,800154347.0,EMPRESA SOCIAL DEL ESTADO HOSPITAL LA CANDELARIA,46594571.0,
ESS024,COOSALUD,800155000.0,HOSPITAL SAN AGUSTIN EMPRESA SOCIAL DEL ESTADO,22123910.0,
ESS024,COOSALUD,800160400.0,E.S.E. HOSPITAL SANTA MARGARITA,3227629.0,
ESS024,COOSALUD,800174123.0,ESE HOSPITAL DE SANTO TOMAS,3189571.0,
ESS024,COOSALUD,800179870.0,HOSPITAL SAN ANDRES E.S.E.,26282714.0,
ESS024,COOSALUD,800190884.0,CLINICA ANTIOQUIA S.A.,119033061.0,
ESS024,COOSALUD,800191643.0,ESE HOSPITAL REGIONNAL II NIVEL DE SAN MARCOS,389069187.0,
ESS024,COOSALUD,800193392.0,E.S.E. HOSPITAL SAN ISIDRO,1328112.0,
ESS024,COOSALUD,800193904.0,E.S.E. HOSPITAL JUAN PABLO II ARATOCA,179779.0,
ESS024,COOSALUD,800196652.0,INSTITUTO CARDIOVASCULAR Y DE ESTUDIOS ESPECIALES LAS VEGAS S.A. INCARE S.A.,212568563.0,
ESS024,COOSALUD,800204153.0,E.S.E. HOSPITAL SAN VICENTE DE PAUL DE LORICA,26592802.0,
ESS024,COOSALUD,800212422.0,CLINICA FARALLONES S A,596172862.0,
ESS024,COOSALUD,800218979.0,HOSPITAL SAN VICENTE ESE,111168092.0,
ESS024,COOSALUD,800227072.0,EUSALUD S.A,916357480.0,
ESS024,COOSALUD,800227877.0,EMPRESA SOCIAL DEL ESTADO HOSPITAL FRANCISCO LUIS JIMENEZ MARTINEZ,2281446.0,
ESS024,COOSALUD,800231215.0,HOSPITAL DEL SARARE ESE,780530264.0,
ESS024,COOSALUD,800231235.0,EMPRESA SOCIAL DEL ESTADO HOSPITAL UNIVERSITARIO SAN JORGE,1762622696.0,
ESS024,COOSALUD,800241602.0,FUNDACION COLOMBIANA DE CANCEROLOGIA CLINICA VIDA,1164880131.0,
ESS024,COOSALUD,800254850.0,EMPRESA SOCIAL DEL ESTADO HOSPITAL SANTA ANA,13397236.0,
ESS024,COOSALUD,801001440.0,RED SALUD ARMENIA ESE UNIDAD INTERMEDIA DEL SUR,1039833.0,
ESS024,COOSALUD,802000333.0,SABBAG RADIOLOGOS S.A.,376715349.0,
ESS024,COOSALUD,802000909.0,CLINICA LOS ALMENDROS SAS,845999000.0,
ESS024,COOSALUD,802001084.0,IPS CLINICA SANTA ANA DE BARANOA,184229292.0,
ESS024,COOSALUD,802001292.0,EMPRESA SOCIAL DEL ESTADO HOSPITAL DE REPELON,8265789.0,
ESS024,COOSALUD,802003081.0,E.S.E. HOSPITAL MUNICIPAL DE SABANAGRANDE,3289081.0,
ESS024,COOSALUD,802004549.0,EMPRESA SOCIAL DEL ESTADO CENTRO DE SALUD DE POLONUEVO,1485000.0,
ESS024,COOSALUD,802006267.0,ESE CENTRO DE SALUD CON CAMAS DE PALMAR DE VARELA,3462530.0,
ESS024,COOSALUD,802009195.0,EMPRESA SOCIAL DEL ESTADO HOSPITAL DE PONEDERA,14535557.0,
ESS024,COOSALUD,802009463.0,ESE CENTRO DE SALUD DE TUBARÁ,3389881.0,
ESS024,COOSALUD,802009783.0,CLINICA SAN RAFAEL LTDA,518721853.0,
ESS024,COOSALUD,802010401.0,HOSPITAL DE MANATI ESE,1356903.0,
ESS024,COOSALUD,802015154.0,FASALUD IPS S.A.S.,51359903.0,
ESS024,COOSALUD,802019573.0,CLINICA PORVENIR LIMITADA,914451513.0,
ESS024,COOSALUD,802021332.0,CLINICA CENTRO S.A,1368920448.0,
ESS024,COOSALUD,804006936.0,ESE CLINICA GUANE Y SU RED INTEGRAL DE SALUD,2398800.0,
ESS024,COOSALUD,804007611.0,ESE CENTRO DE SALUD JUAN SOLERI,3809260.0,
ESS024,COOSALUD,804009658.0,ESE BLANCA ALICIA HERNANDEZ,329800.0,
ESS024,COOSALUD,804014835.0,E.S.E CENTRO DE SALUD MUNICIPIO DE PARAMO,342950.0,
ESS024,COOSALUD,804015007.0,E.S.E CENTRO DE SALUD ENCINO,382600.0,
ESS024,COOSALUD,804015127.0,EMPRESA SOCIAL DEL ESTADO DE OCAMONTE SANTANDER,255443.0,
ESS024,COOSALUD,804016365.0,E.S.E. HOSPITAL EL CARMEN,14638471.0,
ESS024,COOSALUD,805010659.0,AMANECER MEDICO SAS,294242266.0,
ESS024,COOSALUD,805017350.0,HEMATO ONCOLOGOS S.A.,1567856650.0,
ESS024,COOSALUD,805027261.0,E.S.E. RED DE SALUD DEL CENTRO EMPRESA SOCIAL DEL ESTADO HOSPITAL PRIMITIVO IGLESIAS,387085471.0,
ESS024,COOSALUD,805027287.0,E.S.E. RED DE SALUD DEL NORTE EMPRESA SOCIAL DEL ESTADO HOSPITAL JOAQUIN PAZ BORRERO,209225100.0,
ESS024,COOSALUD,805027289.0,E.S.E. RED DE SALUD DE LADERA EMPRESA SOCIAL DEL ESTADO HOSPITAL CAÑAVERALEJO,21151863.0,
ESS024,COOSALUD,805027337.0,RED DE SALUD DEL ORIENTE EMPRESA SOCIAL DEL ESTADO E.S.E,99361319.0,
ESS024,COOSALUD,805027338.0,E.S.E. HOSPITAL CARLOS CARMONA MONTOYA IPS,3413792.0,
ESS024,COOSALUD,805027743.0,DUMIAN MÉDICAL S.A.S,647098176.0,
ESS024,COOSALUD,805028530.0,HOSPITAL ISAIAS DUARTE CANCINO EMPRESA SOCIAL DEL ESTADO,365762747.0,
ESS024,COOSALUD,806001061.0,EMPRESA SOCIAL DEL ESTADO CLINICA MATERNIDAD RAFAEL CALVO,233486327.0,
ESS024,COOSALUD,806005602.0,ESE HOSPITAL LOCAL TURBACO,6572168.0,
ESS024,COOSALUD,806006414.0,E.S.E. HOSPITAL LOCAL SAN JUAN NEPOMUCENO,1253519.0,
ESS024,COOSALUD,806007002.0,ESE HOSPITAL SAN SEBASTIAN,1390218.0,
ESS024,COOSALUD,806007257.0,E.S.E. HOSPITAL LOCAL SANTA MARIA DE MOMPOX BOLIVAR,1649998.0,
ESS024,COOSALUD,806007343.0,ESE HOSPITAL SAN NICOLAS DE TOLENTINO,3925476.0,
ESS024,COOSALUD,806007650.0,CENTRO RADIO-ONCOLOGICO DEL CARIBE S.A.S.,1396243890.0,
ESS024,COOSALUD,806007813.0,ESE HOSPITAL LOCAL SAN JOSE DEACHI,31258930.0,
ESS024,COOSALUD,806007880.0,E.S.E. HOSPITAL LOCAL MAHATES,325000.0,
ESS024,COOSALUD,806007923.0,E.S.E. HOSPITAL LOCAL ARJONA,3203451.0,
ESS024,COOSALUD,806010305.0,ESE HOSPITAL LOCAL CARTAGENA DE INDIAS,43996112.0,
ESS024,COOSALUD,806011261.0,ESTRIOS SAS,1129939832.0,
ESS024,COOSALUD,806013568.0,NEURODINAMIA S.A,309804433.0,
ESS024,COOSALUD,806013598.0,EMPRESA SOCIAL DEL ESTADO RIO GRANDE DE LA MAGDALENA DEL MUNICIPIO DE MAGANGUE,1228400.0,
ESS024,COOSALUD,806015201.0,GESTION SALUD S.A.S.,511999868.0,
ESS024,COOSALUD,806016225.0,CENTRO MEDICO BUENOS AIRES SAS,916165304.0,
ESS024,COOSALUD,807004352.0,EMPRESA SOCIAL DEL ESTADO IMSALUD,40508734.0,
ESS024,COOSALUD,807004393.0,E.S.E. HOSPITAL LOCAL MUNICIPIO DE LOS PATIOS,14511027.0,
ESS024,COOSALUD,807004631.0,E.S.E.HOSPITAL LOCAL VILLA DEL ROSARIO,57050.0,
ESS024,COOSALUD,807004665.0,ESE HOSPITAL JUAN LUIS LONDOÑO,2330378.0,
ESS024,COOSALUD,807008842.0,EMPRESA SOCIAL DEL ESTADO HOSPITAL REGIONAL NOROCCIDENTAL,2239848.0,
ESS024,COOSALUD,807008857.0,ESE HOSPITAL REGIONAL NORTE,11276696.0,
