COD EPS,NOMBRE EPS,NIT IPS,NOMBRE IPS,"TOTAL GIRO 
FEBRERO 2023",OBSERVACIÓN
CCF033,EPS FAMILIAR DE COLOMBIA,800183943.0,CLINICA SANTA MARIA SAS,361426537.0,
CCF033,EPS FAMILIAR DE COLOMBIA,800191643.0,ESE HOSPITAL REGIONNAL II NIVEL DE SAN MARCOS,101982589.0,
CCF033,EPS FAMILIAR DE COLOMBIA,800204153.0,E.S.E. HOSPITAL SAN VICENTE DE PAUL DE LORICA,10612483.0,
CCF033,EPS FAMILIAR DE COLOMBIA,800229958.0,ESCANOGRAFIA SINCELEJO SAS,60459614.0,
CCF033,EPS FAMILIAR DE COLOMBIA,802020334.0,QUIMIOSALUD S.A.S,1282500.0,
CCF033,EPS FAMILIAR DE COLOMBIA,805011262.0,RTS S.A.S,317604687.0,
CCF033,EPS FAMILIAR DE COLOMBIA,812002958.0,CLINICA LA TRINIDAD I.P.S. LTDA,4739019.0,
CCF033,EPS FAMILIAR DE COLOMBIA,812004935.0,CLINICA MATERNO INFANTIL CASA DEL NIÑO S.A.S,7774915.0,
CCF033,EPS FAMILIAR DE COLOMBIA,812005522.0,FUNDACION AMIGOS DE LA SALUD,136300415.0,
CCF033,EPS FAMILIAR DE COLOMBIA,812005726.0,EMPRESA SOCIAL DEL ESTADO VIDASINU,60821135.0,
CCF033,EPS FAMILIAR DE COLOMBIA,812007194.0,ONCOMEDICA S.A.S,252364364.0,
CCF033,EPS FAMILIAR DE COLOMBIA,823002227.0,INSTITUTO DE CANCEROLOGIA DE SUCRE S.A.S.,177006906.0,
CCF033,EPS FAMILIAR DE COLOMBIA,823002800.0,OFTALMOLOGOS ASOCIADOS DE LA COSTA SAS,298481404.0,
CCF033,EPS FAMILIAR DE COLOMBIA,823002991.0,CLINICA SALUD SOCIAL S.A.S,57374341.0,
CCF033,EPS FAMILIAR DE COLOMBIA,823003752.0,I.P.S. UNIDAD MEDICA EL BOSQUE S.A.S.,15722497.0,
CCF033,EPS FAMILIAR DE COLOMBIA,823004881.0,I.P.S. CLINICA GUARANDA SANA S.A.S.,25603762.0,
CCF033,EPS FAMILIAR DE COLOMBIA,823004895.0,UNIDAD MEDICA INTEGRAL DEL SAN JORGE LIMITADA,1332465.0,
CCF033,EPS FAMILIAR DE COLOMBIA,830010337.0,SANOFI-AVENTIS DE COLOMBIA S.A.,48417852.0,
CCF033,EPS FAMILIAR DE COLOMBIA,830510991.0,CLÍNICA ESPECIALIZADA LA CONCEPCIÓN S.A.S,327884730.0,
CCF033,EPS FAMILIAR DE COLOMBIA,830511549.0,RESONANCIA E IMÁGENES SANTA MARIA S.A,33350583.0,
CCF033,EPS FAMILIAR DE COLOMBIA,890480113.0,HOSPITAL REGIONAL NUESTRA SEÑORA DE LAS MERCEDES DE COROZAL E.S.E.,133622100.0,
CCF033,EPS FAMILIAR DE COLOMBIA,891079999.0,ESE HOSPITAL SAN JERÓNIMO DE MONTERÍA,40914945.0,
CCF033,EPS FAMILIAR DE COLOMBIA,892200273.0,CLINICA LAS PEÑITAS S.A.S,6801464.0,
CCF033,EPS FAMILIAR DE COLOMBIA,892201100.0,LIGA CONTRA EL CÁNCER SECCIONAL SUCRE,44536540.0,
CCF033,EPS FAMILIAR DE COLOMBIA,892280033.0,HOSPITAL UNIVERSITARIO DE SINCELEJO E.S.E,489386500.0,
CCF033,EPS FAMILIAR DE COLOMBIA,900015779.0,SOCIEDAD DE HEMODINAMIA SANTA MARIA S.A.S,170512431.0,
CCF033,EPS FAMILIAR DE COLOMBIA,900025914.0,AMRITZAR S.A.,25382005.0,
CCF033,EPS FAMILIAR DE COLOMBIA,900047571.0,IPSI OUTAJIAPALA,52920000.0,
CCF033,EPS FAMILIAR DE COLOMBIA,900116275.0,UNIDAD DE DIAGNOSTICO CLINICO O IMAGENOLOGICO E.U.,13205471.0,
CCF033,EPS FAMILIAR DE COLOMBIA,900118990.0,CENTRO DE FISIOTERAPIA REHABILITAR DRA. MARTA CANTILLO MARTINEZ S.A.S.,110250000.0,
CCF033,EPS FAMILIAR DE COLOMBIA,900119472.0,IPS TOLUSALUD LTDA,55964832.0,
CCF033,EPS FAMILIAR DE COLOMBIA,900164946.0,CLINICA PEDIATRICA NIÑO JESUS S.A.S,74778276.0,
CCF033,EPS FAMILIAR DE COLOMBIA,900172745.0,UNIDAD DE DIAGNOSTICO GINECOLOGICO Y PRENATAL SER MUJER S.A.S,2855348.0,
CCF033,EPS FAMILIAR DE COLOMBIA,900177624.0,ANASHIWAYA IPSI,40115113.0,
CCF033,EPS FAMILIAR DE COLOMBIA,900188717.0,IPS IMAGEN DIAGNOSTICA S.A.S,38977871.0,
CCF033,EPS FAMILIAR DE COLOMBIA,900196346.0,ESE HOSPITAL NUESTRA SEÑORA DEL CARMEN,1793051.0,
CCF033,EPS FAMILIAR DE COLOMBIA,900196347.0,EMPRESA SOCIAL DEL ESTADO HOSPITAL LA DIVINA MISERICORDIA,223364171.0,
CCF033,EPS FAMILIAR DE COLOMBIA,900217343.0,CLINICA OFTALMOLOGICA DE SUCRE S.A.S,52038876.0,
CCF033,EPS FAMILIAR DE COLOMBIA,900219120.0,VIVA 1A IPS SA,386320000.0,
CCF033,EPS FAMILIAR DE COLOMBIA,900233294.0,CLINICA GENERAL DEL CARIBE S.A.,6719155.0,
CCF033,EPS FAMILIAR DE COLOMBIA,900324225.0,"SOCIEDAD PARA LA ATENCION MEDICA E IMAGENES DIAGNOSTICAS SAS ""SOMID SAS """,65186530.0,
CCF033,EPS FAMILIAR DE COLOMBIA,900328332.0,CARDIOCARE SERVICES SAS,67440859.0,
CCF033,EPS FAMILIAR DE COLOMBIA,900449481.0,MEDICINA INTEGRAL DEL CARIBE SAS,14671302.0,
CCF033,EPS FAMILIAR DE COLOMBIA,900468210.0,CENTRO DE RESONANCIA MAGNETICA DEL NORTE S.A.S,10200055.0,
CCF033,EPS FAMILIAR DE COLOMBIA,900508066.0,CMIACIPSGUAJIRA SAS,5525000.0,
CCF033,EPS FAMILIAR DE COLOMBIA,900513306.0,FUNDACION MARIA REINA,25942498.0,
CCF033,EPS FAMILIAR DE COLOMBIA,900550249.0,IPS CARDIOCENTRO PEDIATRICO DE SUCRE S.A.S,31897242.0,
CCF033,EPS FAMILIAR DE COLOMBIA,900581036.0,GASTROCENTRO S.A.S,16125842.0,
CCF033,EPS FAMILIAR DE COLOMBIA,900656493.0,IPS PUNTO VITAL SAS,762157466.0,
CCF033,EPS FAMILIAR DE COLOMBIA,900734605.0,CENTRO DE REHABILITACION TERAPEUTICO INTEGRAL S.A.S.,23231500.0,
CCF033,EPS FAMILIAR DE COLOMBIA,900794134.0,IPS INDIGENA KOTTUSHI SAO ANA>A,595350000.0,
CCF033,EPS FAMILIAR DE COLOMBIA,900795851.0,IPSI EITERRA JAWAPIA,299880000.0,
CCF033,EPS FAMILIAR DE COLOMBIA,900798865.0,911 ASITENCIA MEDICA DOMICILIARIA IPS SAS,30915915.0,
CCF033,EPS FAMILIAR DE COLOMBIA,900803163.0,AMBULANCIAS AB IPS S.A.S,1826769.0,
CCF033,EPS FAMILIAR DE COLOMBIA,900839714.0,PROFHARMA SALUD IPS S.A.S,50933573.0,
CCF033,EPS FAMILIAR DE COLOMBIA,900874167.0,OPTIMUS HEALTH SAS,8301705.0,
CCF033,EPS FAMILIAR DE COLOMBIA,900919030.0,IPS LA DIVINA MISERICORDIA S.A.S,148816098.0,
CCF033,EPS FAMILIAR DE COLOMBIA,900959051.0,SUBRED INTEGRADA DE SERVICIOS DE SALUD CENTRO ORIENTE E.S.E,11146787.0,
CCF033,EPS FAMILIAR DE COLOMBIA,900995574.0,MEDIPOHDS,313945879.0,
CCF033,EPS FAMILIAR DE COLOMBIA,901085352.0,INSTITUTO MEDICO DE ALTA TECNOLOGÍA S.A.S,61843427.0,
CCF033,EPS FAMILIAR DE COLOMBIA,901094037.0,TRAUMACENTRO S.A.S,3405855.0,
CCF033,EPS FAMILIAR DE COLOMBIA,901139193.0,MIRED BARRANQUILLA IPS S.A.S.,2476710.0,
CCF033,EPS FAMILIAR DE COLOMBIA,901161920.0,FUNDACION AZUL REY,65400000.0,
CCF033,EPS FAMILIAR DE COLOMBIA,901182802.0,SERVICIOS MEDICOS INTEGRALES IPS S.A.S,640120000.0,
CCF033,EPS FAMILIAR DE COLOMBIA,901204233.0,ROSARY HEALTH CARE SAS,11642300.0,
CCF033,EPS FAMILIAR DE COLOMBIA,901314216.0,MEDI VIDA IPS S.A.S,301952501.0,
CCF033,EPS FAMILIAR DE COLOMBIA,901341454.0,INTTEGRAL I.P.S S.A.S,80610000.0,
CCF033,EPS FAMILIAR DE COLOMBIA,901353186.0,UCI LAS MERCEDES DE COROZAL SAS,48971965.0,
CCF033,EPS FAMILIAR DE COLOMBIA,901483168.0,GHG GLOBAL HEALTH GROUP SAS,248975340.0,
CCF033,EPS FAMILIAR DE COLOMBIA,901489682.0,CLINICA DE SALUD MENTAL SANTA TERESA SAS,8210154.0,
CCF050,COMFAORIENTE,800012189.0,CLINICA SAN JOSE DE CUCUTA SA,1427699181.0,
CCF050,COMFAORIENTE,800014918.0,E.S.E. HOSPITAL UNIVERSITARIO ERASMO MEOZ,912505478.0,
CCF050,COMFAORIENTE,800026173.0,ESE HOSPITAL HELI MORENO BLANCO,3381351.0,
CCF050,COMFAORIENTE,800084206.0,EMPRESA SOCIAL DEL ESTADO INSTITUTO DE SALUD DE BUCARAMANGA,1120707.0,
CCF050,COMFAORIENTE,800099778.0,ASOCIACIÓN NIÑOS DE PAPEL,2149850.0,
CCF050,COMFAORIENTE,800106375.0,NUCLEAR SAN JOSE S.A.,26514494.0,
CCF050,COMFAORIENTE,800165163.0,ODONTOCUCUTA S.A,3888326.0,
CCF050,COMFAORIENTE,804015473.0,UNIDAD ESPECIALIZADA EN ATENCIÓN TERAPÉUTICA S.A.S IPS - UNESAT S.A.S. IPS,1864100.0,
CCF050,COMFAORIENTE,805011262.0,RTS S.A.S,170286045.0,
CCF050,COMFAORIENTE,805027743.0,DUMIAN MÉDICAL S.A.S,18781692.0,
CCF050,COMFAORIENTE,807000799.0,UROLOGOS DEL NORTE DE SANTANDER URONORTE S.A.,68759492.0,
CCF050,COMFAORIENTE,807000832.0,LABORATORIO CLINICO ESPECIALIZADO LTDA,5548200.0,
CCF050,COMFAORIENTE,807001041.0,CENTRO MEDICO LA SAMARITANA LTDA,9180215.0,
CCF050,COMFAORIENTE,807001311.0,SERVICIOS INTEGRALES DE SALUD LTDA -SERINSA,101312223.0,
CCF050,COMFAORIENTE,807002152.0,CLINICA OFTALMOLOGICA PEÑARANDA S.A.S,104153863.0,
CCF050,COMFAORIENTE,807002424.0,CLINICA DE CANCEROLOGIA DEL NORTE DE SANTANDER LTDA.,1153913587.0,
CCF050,COMFAORIENTE,807003768.0,RADIOTERAPIA DEL NORTE LTDA.,65523296.0,
CCF050,COMFAORIENTE,807004352.0,EMPRESA SOCIAL DEL ESTADO IMSALUD,20736340.0,
CCF050,COMFAORIENTE,807004393.0,E.S.E. HOSPITAL LOCAL MUNICIPIO DE LOS PATIOS,1299292.0,
CCF050,COMFAORIENTE,807004631.0,E.S.E.HOSPITAL LOCAL VILLA DEL ROSARIO,1751890.0,
CCF050,COMFAORIENTE,807004665.0,ESE HOSPITAL JUAN LUIS LONDOÑO,1940688.0,
CCF050,COMFAORIENTE,807005711.0,"ASOCIACION DE PATOLOGOS ""ASOPAT"" LTDA.",3515435.0,
CCF050,COMFAORIENTE,807008824.0,E.S.E. HOSPITAL REGIONAL CENTRO,1591369.0,
CCF050,COMFAORIENTE,807008827.0,E.S.E. HOSPITAL REGIONAL SURORIENTAL-CHINACOTA,1353370.0,
CCF050,COMFAORIENTE,807008842.0,EMPRESA SOCIAL DEL ESTADO HOSPITAL REGIONAL NOROCCIDENTAL,2015065.0,
CCF050,COMFAORIENTE,814003448.0,AUDIOCOM IPS,14417580.0,
CCF050,COMFAORIENTE,829001256.0,ESE HOSPITAL MANUEL ELKIN PATARROYO,1947953.0,
CCF050,COMFAORIENTE,830007355.0,FRESENIUS MEDICAL CARE COLOMBIA S.A.,196959960.0,
CCF050,COMFAORIENTE,860013779.0,ASOCIACIÓN PROFAMILIA,49509757.0,
CCF050,COMFAORIENTE,890208758.0,CLINICA MATERNO INFANTIL SAN LUIS S.A,23856193.0,
CCF050,COMFAORIENTE,890212568.0,FUNDACION CARDIOVASCULAR DE COLOMBIA,562578425.0,
CCF050,COMFAORIENTE,890500060.0,CLINICA SANTA ANA S.A.,465031367.0,
CCF050,COMFAORIENTE,890500810.0,E.S.E. HOSPITAL MENTAL RUDESINDO SOTO,159524670.0,
CCF050,COMFAORIENTE,890501019.0,ESE HOSPITAL SAN JUAN DE DIOS DE PAMPLONA,58042937.0,
CCF050,COMFAORIENTE,890501438.0,E.S.E. HOSPITAL EMIRO QUINTERO CAÑIZARES,536910000.0,
CCF050,COMFAORIENTE,890503532.0,CLINICA LOS ANDES LTDA.,74907600.0,
CCF050,COMFAORIENTE,890505755.0,OPTICA CIENTIFICA Y CIA LTDA,12665900.0,
CCF050,COMFAORIENTE,890506459.0,CLINICA Y DROGUERIA NTRA SRA DE TORCOROMA S.A.S.,205127698.0,
CCF050,COMFAORIENTE,890900518.0,FUNDACION HOSPITALARIA SAN VICENTE DE PAUL,72669208.0,
CCF050,COMFAORIENTE,890904646.0,"HOSPITAL GENERAL DE MEDELLIN LUZ CASTRO DE GUTIERREZ, EMPRESA SOCIAL DEL ESTADO",9223025.0,
CCF050,COMFAORIENTE,891180134.0,E.S.E. HOSPITAL DEPARTAMENTAL SAN ANTONIO DE PITALITO,1874237.0,
CCF050,COMFAORIENTE,891580002.0,HOSPITAL UNIVERSITARIO SAN JOSE DE POPAYAN E.S.E.,2386639.0,
CCF050,COMFAORIENTE,891855438.0,EMPRESA SOCIAL DEL ESTADO HOSPITAL REGIONAL DE DUITAMA,1137315.0,
CCF050,COMFAORIENTE,899999092.0,INSTITUTO NACIONAL DE CANCEROLOGIA - EMPRESA SOCIAL DEL ESTADO,4641476.0,
CCF050,COMFAORIENTE,900006037.0,EMPRESA SOCIAL DEL ESTADO HOSPITAL UNIVERSITARIO DE SANTANDER,101418083.0,
CCF050,COMFAORIENTE,900017916.0,SERVICIOS ESPECIALIZADOS FCB S.A.S,1206419.0,
CCF050,COMFAORIENTE,900037353.0,ONCOMEDICAL I.P.S. S.A.S,407865310.0,
CCF050,COMFAORIENTE,900041610.0,TRANSPORTE SALUD IMÁGENES TRANSALIM LTDA,160830952.0,
CCF050,COMFAORIENTE,900066347.0,E.S.E. HOSPITAL REGIONAL SAN GIL,9993540.0,
CCF050,COMFAORIENTE,900075758.0,GASTROQUIRURGICA S.A.S.,109528995.0,
CCF050,COMFAORIENTE,900112351.0,UNIDAD HEMATO ONCOLOGICA ESPECIALIZADA IPS SAS,254919378.0,
CCF050,COMFAORIENTE,900155231.0,SANAMEDIC SOCIEDAD POR ACCIONES SIMPLIFICADA - S.A.S,28282047.0,
CCF050,COMFAORIENTE,900191362.0,SOCIEDAD DE OFTALMOLOGIA Y CIRUGIA PLASTICA DE CUCUTA S.A.,59418870.0,
CCF050,COMFAORIENTE,900204617.0,MEDICUC IPS LTDA,14207551.0,
CCF050,COMFAORIENTE,900222303.0,"ATENCION EN REHABILITACION INTEGRAL S.A.S. ""ATERIN S.A.S.""",4651080.0,
CCF050,COMFAORIENTE,900225631.0,VIDAMEDICAL IPS S.A.S.,202079000.0,
CCF050,COMFAORIENTE,900241448.0,CARDIOLOGIA DIAGNOSTICA DEL NORTE S.A.S.- CARDINOR S.A.S.,2027813.0,
CCF050,COMFAORIENTE,900241734.0,CONFESALUD IPS LTDA.,8105834.0,
CCF050,COMFAORIENTE,900257281.0,IPS MEDCARE DE COLOMBIA S.A.S.,4672500.0,
CCF050,COMFAORIENTE,900301770.0,NEUROCOOP REHABILITACION FISICA Y MEDICA INTEGRAL,742975025.0,
CCF050,COMFAORIENTE,900307987.0,VITAL MEDICAL CARE VIMEC S.A.S,82258650.0,
CCF050,COMFAORIENTE,900309444.0,HOSPICLINIC DE COLOMBIA S.A.S.,64308272.0,
CCF050,COMFAORIENTE,900315341.0,PIEL MEDICALSPA CENTRO DERMATOLOGICO IPS SAS,31338102.0,
CCF050,COMFAORIENTE,900332743.0,CENTRO DE ECO-RADIODIAGNOSTICOS S.A.S,71375452.0,
CCF050,COMFAORIENTE,900338359.0,IPS REHABILITACION INTEGRAL MARTA OMAÑA ASOCIADOS S.A.S,17466000.0,
CCF050,COMFAORIENTE,900386919.0,INSTITUTO NEUROLOGICO INFANTIL S.A.S.,62515264.0,
CCF050,COMFAORIENTE,900395846.0,SERVICIOS VIVIR S.A.S.,20917280.0,
CCF050,COMFAORIENTE,900470642.0,MEDICAL DUARTE ZF S.A.S,2728650904.0,
CCF050,COMFAORIENTE,900471992.0,NEUROALIADOS MEDICINA ESPECIALIZADA S.A.S.,95446034.0,
CCF050,COMFAORIENTE,900535099.0,DROGUERIA MAGRETH S.A.S.,374131299.0,
CCF050,COMFAORIENTE,900542979.0,CENTRO INTEGRAL DE ATENCION DIAGNOSTICA ESPECIALIZADA IPS SAS,901793768.0,
CCF050,COMFAORIENTE,900575153.0,ANGIOVASCULAR MORENO,39138538.0,
CCF050,COMFAORIENTE,900580962.0,DISFARMA G.C. S.A.S.,1085107665.0,
CCF050,COMFAORIENTE,900595259.0,SERVIMOS AMBULANCIAS DE COLOMBIA IPS S.A.S.,5411000.0,
CCF050,COMFAORIENTE,900635297.0,UNIDAD DE MEDICINA MATERNOFETAL NORFETUS SOCIEDAD POR ACCIONES SIMPLIFICADA,23849098.0,
CCF050,COMFAORIENTE,900704446.0,ECOIMAGEN SALUD S.A.S.,153288944.0,
CCF050,COMFAORIENTE,900717202.0,CENTRO INTEGRAL DE DIAGNOSTICO MEDICO I.P.S. S.A.S.,35718960.0,
CCF050,COMFAORIENTE,900752620.0,IPS CLINICAL HOUSE S.A.S.,89939010.0,
CCF050,COMFAORIENTE,900900155.0,CENTRO DE CUIDADOS CARDIONEUROVASCULARES PABON SAS,49387336.0,
CCF050,COMFAORIENTE,900900693.0,INSTITUCION PRESTADORA DE SERVICIOS DE SALUD DOMICILIARIOS SANARTE CLÍNICA DE HERIDAS Y OSTOMIAS S.A.S.,110189740.0,
CCF050,COMFAORIENTE,901127399.0,NEUMOLOGIA Y SERVICIOS DE REHABILITACION S.A.S,34111077.0,
CCF050,COMFAORIENTE,901220248.0,HELP TRAUMA SALUD Y ORTOPEDIA IPS SAS,2996280.0,
CCF050,COMFAORIENTE,901222235.0,UNIDAD DE HEMODINAMIA Y TERAPIA ENDOVASCULAR DEL NORTE DE SANTANDER S.A.S,11968189.0,
CCF050,COMFAORIENTE,901254971.0,CENTRO DE ATENCION MI RENACER S.A.S.,55099570.0,
CCF050,COMFAORIENTE,901313049.0,RED SALUD INTEGRAL IPS S.A.S.,68195200.0,
CCF050,COMFAORIENTE,901315238.0,IMAGEN DENTAL INTEGRAL IPS S.A.S.,158104378.0,
CCF050,COMFAORIENTE,901383010.0,UCIS DE COLOMBIA S.A.S.,243549343.0,
CCF050,COMFAORIENTE,901417815.0,SOLUCIONES MEDICAS AVANZADAS S.A.S,9775282.0,
CCF055,CAJACOPI,800000118.0,EMPRESA SOCIAL DEL ESTADO HOSPITAL DEPARTAMENTAL UNIVERSITARIO DEL QUINDIO SAN JUAN DE DIOS,106972955.0,
CCF055,CAJACOPI,800018233.0,SOMECA MALAMBO,6983422.0,
CCF055,CAJACOPI,800037021.0,HOSPITAL DEPARTAMENTAL DE GRANADA - EMPRESA SOCIAL DEL META,657491437.0,
CCF055,CAJACOPI,800037202.0,HOSPITAL PRIMER NIVEL DE GUAMAL,2386284.0,
CCF055,CAJACOPI,800037979.0,E.S.E. HOSPITAL LOCAL DE PUERTO LOPEZ,7966197.0,
CCF055,CAJACOPI,800058016.0,EMPRESA SOCIAL DEL ESTADO METROSALUD,34885387.0,
CCF055,CAJACOPI,800066001.0,CENTRO MEDICO OFTALMOLOGICO Y LABORATORIO CLINICO ANDRADE NARVAEZ SIGLA COLCAN S.A.S.,99945451.0,
CCF055,CAJACOPI,800067514.0,COMITÉ MUNICIPAL DE LA CRUZ ROJA DE MAICAO,21749495.0,
CCF055,CAJACOPI,800075650.0,EMPRESA SOCIAL DEL ESTADO HOSPITAL SANTO TOMAS,4584350.0,
CCF055,CAJACOPI,800101022.0,ESE HOSPITAL NUESTRA SEÑORA DEL PILAR,4593100.0,
CCF055,CAJACOPI,800112725.0,FUNDACION OFTALMOLOGICA DEL CARIBE,126325623.0,
CCF055,CAJACOPI,800119945.0,HOSPITAL SAN ROQUE ESE,1836671.0,
CCF055,CAJACOPI,800129856.0,CLINICA DE LA COSTA S.A.S.,261050331.0,
CCF055,CAJACOPI,800130625.0,ESE HOSPITAL SAN CRISTOBAL DE CIENAGA,21693298.0,
CCF055,CAJACOPI,800150497.0,ESE HOSPITAL FRANCISCO CANOSSA,1878955.0,
CCF055,CAJACOPI,800154347.0,EMPRESA SOCIAL DEL ESTADO HOSPITAL LA CANDELARIA,180322453.0,
CCF055,CAJACOPI,800162035.0,SERVICIOS MEDICOS INTEGRALES DE SALUD SAS SERVIMEDICOS SAS,107656239.0,
CCF055,CAJACOPI,800174123.0,ESE HOSPITAL DE SANTO TOMAS,2517820.0,
CCF055,CAJACOPI,800174375.0,E.S.E. HOSPITAL SAN VICENTE DE PAUL DE FOMEQUE,1857362.0,
CCF055,CAJACOPI,800175901.0,CLINICA EMPERATRIZ SAS,99487621.0,
CCF055,CAJACOPI,800183943.0,CLINICA SANTA MARIA SAS,62148284.0,
CCF055,CAJACOPI,800187260.0,INSTITUTO DE ENFERMEDADES DIGESTIVAS DE COLOMBIA S.A.S,46569944.0,
CCF055,CAJACOPI,800191643.0,ESE HOSPITAL REGIONNAL II NIVEL DE SAN MARCOS,27509454.0,
CCF055,CAJACOPI,800193989.0,CENTRO DIAGNOSTICO DE ESPECIALISTAS LTDA,89624299.0,
CCF055,CAJACOPI,800194798.0,ORGANIZACION CLINICA BONNADONA PREVENIR S.A.S.,85055459.0,
CCF055,CAJACOPI,800197217.0,CLINICA DE ESPECIALISTAS MARIA AUXILIADORA S.A.S.,97536322.0,
CCF055,CAJACOPI,800197424.0,ASOCIACION MEDICA DE MEDICINA NUCLEAR LTDA NUCLEAR 2000 LTDA,40411748.0,
CCF055,CAJACOPI,800201726.0,FUNDACION POLICLINICA CIENAGA,164721752.0,
CCF055,CAJACOPI,800204153.0,E.S.E. HOSPITAL SAN VICENTE DE PAUL DE LORICA,435235335.0,
CCF055,CAJACOPI,800222844.0,RADIOIMAGENES RADIOLOGOS ASOCIADOS S.A.S.,59091720.0,
CCF055,CAJACOPI,800227279.0,TECNITRAUMA S.A.,399999999.0,
CCF055,CAJACOPI,800227877.0,EMPRESA SOCIAL DEL ESTADO HOSPITAL FRANCISCO LUIS JIMENEZ MARTINEZ,1011524.0,
CCF055,CAJACOPI,800234339.0,LABORATORIO CLINICO PROCESAR IPS SAS,114960931.0,
CCF055,CAJACOPI,800234860.0,LITOTRICIA S.A.,3714727.0,
CCF055,CAJACOPI,800235973.0,CENTRO DE DIALISIS SANTA MARGARITA,60766152.0,
CCF055,CAJACOPI,802000909.0,CLINICA LOS ALMENDROS SAS,217526139.0,
CCF055,CAJACOPI,802001084.0,IPS CLINICA SANTA ANA DE BARANOA,28814860.0,
CCF055,CAJACOPI,802003081.0,E.S.E. HOSPITAL MUNICIPAL DE SABANAGRANDE,3711873.0,
CCF055,CAJACOPI,802003414.0,EMPRESA SOCIAL DEL ESTADO HOSPITAL DE JUAN DE ACOSTA,6186951.0,
CCF055,CAJACOPI,802004549.0,EMPRESA SOCIAL DEL ESTADO CENTRO DE SALUD DE POLONUEVO,35926950.0,
CCF055,CAJACOPI,802006267.0,ESE CENTRO DE SALUD CON CAMAS DE PALMAR DE VARELA,3097447.0,
CCF055,CAJACOPI,802006337.0,TAMARA IMÁGENES DIAGNOSTICAS S.A.S,249698204.0,
CCF055,CAJACOPI,802007798.0,EMPRESA SOCIAL DEL ESTADO CENTRO DE SALUD DE GALAPA,2653223.0,
CCF055,CAJACOPI,802009463.0,ESE CENTRO DE SALUD DE TUBARÁ,22907169.0,
CCF055,CAJACOPI,802009783.0,CLINICA SAN RAFAEL LTDA,99240330.0,
CCF055,CAJACOPI,802009914.0,VISION DEL LITORAL SAS,48696836.0,
CCF055,CAJACOPI,802010728.0,UROCENTRO LTDA,239373630.0,
CCF055,CAJACOPI,802014132.0,INSTITUTO DE TRASPLANTE DE MÉDULA OSEA DE LA COSTA IPS S.A.S,142165278.0,
CCF055,CAJACOPI,802019573.0,CLINICA PORVENIR LIMITADA,126821982.0,
CCF055,CAJACOPI,802019914.0,MAXIVISION LTDA IPS,161572470.0,
CCF055,CAJACOPI,802019932.0,I.P.S SALUD PLENA S.A.S,23020171.0,
CCF055,CAJACOPI,802020334.0,QUIMIOSALUD S.A.S,357401355.0,
CCF055,CAJACOPI,802022775.0,CENTRO DE SALUD AGRUPASALUD IPS SAS,63555164.0,
CCF055,CAJACOPI,802025301.0,IPS CENTRO DE ATENCION PULMONAR CAP LTDA,4927384.0,
CCF055,CAJACOPI,805010659.0,AMANECER MEDICO SAS,6039518.0,
CCF055,CAJACOPI,806001061.0,EMPRESA SOCIAL DEL ESTADO CLINICA MATERNIDAD RAFAEL CALVO,50284883.0,
CCF055,CAJACOPI,806005602.0,ESE HOSPITAL LOCAL TURBACO,1424875.0,
CCF055,CAJACOPI,806006414.0,E.S.E. HOSPITAL LOCAL SAN JUAN NEPOMUCENO,1054288.0,
CCF055,CAJACOPI,806007923.0,E.S.E. HOSPITAL LOCAL ARJONA,820899.0,
CCF055,CAJACOPI,806008356.0,UCI DEL CARIBE SAS,5949099.0,
CCF055,CAJACOPI,806008828.0,FUNDACIÓN CENTRO MEDICO PARA EL DESARROLLO HUMANO EN SALUD,289755007.0,
CCF055,CAJACOPI,806010305.0,ESE HOSPITAL LOCAL CARTAGENA DE INDIAS,3199688.0,
CCF055,CAJACOPI,806015513.0,CENTRO DE REHABILITACION FISICA LUCY ORDOÑEZ SAS,6668861.0,
CCF055,CAJACOPI,812000300.0,ESE HOSPITAL SAGRADO CORAZON DE JESUS,1942090.0,
CCF055,CAJACOPI,812000317.0,ESE HOSPITAL SAN JOSE DE TIERRALTA,6628214.0,
CCF055,CAJACOPI,812000527.0,CLINICA SAHAGUN I.P.S. S.A,119524980.0,
CCF055,CAJACOPI,812001219.0,E.S.E HOSPITAL SAN JORGE,1389643.0,
CCF055,CAJACOPI,812001520.0,E.S.E. CAMU DE PUEBLO NUEVO,22901750.0,
CCF055,CAJACOPI,812001579.0,ESE CAMU SAN RAFAEL,1664489.0,
CCF055,CAJACOPI,812001792.0,E.S.E CAMU DE PURISIMA,282700.0,
CCF055,CAJACOPI,812001868.0,E.S.E. HOSPITAL SAN JOSÉ DE CANALETE,1462622.0,
CCF055,CAJACOPI,812002836.0,ESE CAMU DEL PRADO,1901751.0,
CCF055,CAJACOPI,812002958.0,CLINICA LA TRINIDAD I.P.S. LTDA,100000003.0,
CCF055,CAJACOPI,812003676.0,OPTICA SOCIAL SAS,1286005.0,
CCF055,CAJACOPI,812003726.0,E.S.E. CENTRO DE SALUD DE COTORRA,951307.0,
CCF055,CAJACOPI,812003851.0,ESE HOSPITAL SAN JUAN DE SAHAGUN,196402558.0,
CCF055,CAJACOPI,812004935.0,CLINICA MATERNO INFANTIL CASA DEL NIÑO S.A.S,88001005.0,
CCF055,CAJACOPI,812005323.0,TERAPIAS INTEGRALES S.A.S.,1748331.0,
CCF055,CAJACOPI,812005522.0,FUNDACION AMIGOS DE LA SALUD,200284792.0,
CCF055,CAJACOPI,812005644.0,CLINICA REGIONAL DEL SAN JORGE AGENCIA YOPAL,43616570.0,
CCF055,CAJACOPI,812005726.0,EMPRESA SOCIAL DEL ESTADO VIDASINU,316943513.0,
CCF055,CAJACOPI,812007194.0,ONCOMEDICA S.A.S,196298166.0,
CCF055,CAJACOPI,812007222.0,CENTRO DE CIRUGIA S.A.S,15280071.0,
CCF055,CAJACOPI,813001952.0,CLINICA MEDILASER S.A.S.,54213076.0,
CCF055,CAJACOPI,813005265.0,E.S.E. CARMEN EMILIA OSPINA DE NEIVA,1287379.0,
CCF055,CAJACOPI,813008574.0,MEGASALUD IPS SAS,58289349.0,
CCF055,CAJACOPI,813011577.0,CLINICA UROS S.A.S - TORRE A,43144206.0,
CCF055,CAJACOPI,819001107.0,EMPRESA SOCIAL DEL ESTADO HOSPITAL LOCAL ALEJANDRO MAESTRE SIERRA,2925965.0,
CCF055,CAJACOPI,819001269.0,E.S.E. HOSPITAL LOCAL DE CHIVOLO,579399.0,
CCF055,CAJACOPI,819001274.0,ESE HOSPITAL LOCAL PIJIÑO DEL CARMEN,1290618.0,
CCF055,CAJACOPI,819001345.0,HOSPITAL DE PEDRAZA E.S.E.,410008.0,
CCF055,CAJACOPI,819001483.0,EMPRESA SOCIAL DEL ESTADO HOSPITAL FRAY LUIS DE LEON,29655171.0,
CCF055,CAJACOPI,819001796.0,EMPRESA SOCIAL DEL ESTADO HOSPITAL LOCAL DE EL RETEN,4126123.0,
CCF055,CAJACOPI,819002025.0,E.S.E HOSPITAL SANTANDER HERRERA DE PIVIJAY,203606610.0,
CCF055,CAJACOPI,819002176.0,COMPAÑÍA COLOMBIANA DE SALUD COLSALUD S.A,207578283.0,
CCF055,CAJACOPI,819002228.0,CENTRO DE IMÁGENES DIAGNOSTICAS SANTA MARTA S.A.S,2788453.0,
CCF055,CAJACOPI,819002363.0,ESE HOSPITAL 7 DE AGOSTO,25423112.0,
CCF055,CAJACOPI,819002534.0,EMPRESA SOCIAL DEL ESTADO HOSPITAL NUESTRA SEÑORA DEL CARMEN,967475.0,
CCF055,CAJACOPI,819002551.0,EMPRESA SOCIAL DEL ESTADO CENTRO DE SALUD PAZ DEL RIO,64142992.0,
CCF055,CAJACOPI,819003618.0,EMPRESA SOCIAL DEL ESTADO HOSPITAL LOCAL DE ALGARROBO,1370636.0,
CCF055,CAJACOPI,819003863.0,PREVENCION Y SALUD INTEGRAL PARA LA FAMILIA IPS LTDA,60052976.0,
CCF055,CAJACOPI,819004070.0,ESE ALEJANDRO PROSPERO REVEREND,14340661.0,
CCF055,CAJACOPI,819004229.0,FUNDACION ESTILO DE VIDA SALUDABLE ESVIDA IPS,9012482.0,
CCF055,CAJACOPI,819004276.0,CLÍNICA LA ESPERANZA IPS S.A.S.,1813558.0,
CCF055,CAJACOPI,819004280.0,SAMUEL VILLANUEVA VALEST EMPRESA SOCIAL DEL ESTADO,803716.0,
CCF055,CAJACOPI,819004318.0,ESE HOSPITAL LOCAL DE NUEVA GRANADA,4156158.0,
CCF055,CAJACOPI,819006193.0,INSTITUTO NEUROPSIQUIATRICO NUESTRA SEÑORA DEL CARMEN INSECAR,9143601.0,
CCF055,CAJACOPI,819006461.0,GASTROMAG SAS,6547674.0,
CCF055,CAJACOPI,820001277.0,CENTRO DE CANCEROLOGÍA DE BOYACÁ SAS.,173486334.0,
CCF055,CAJACOPI,820002854.0,ESE CENTRO DE SALUD NUESTRA SEÑORA DE LA PAZ,12650.0,
CCF055,CAJACOPI,820002928.0,NEFROBOYACA SAS,33812039.0,
CCF055,CAJACOPI,820003422.0,EMPRESA SOCIAL DEL ESTADO CENTRO DE SALUD SAN PABLO DE BORBUR,703320.0,
CCF055,CAJACOPI,820003435.0,EMPRESA SOCIAL DEL ESTADO CENTRO DE SALUD DE TOGUI,787150.0,
CCF055,CAJACOPI,820003524.0,EMPRESA SOCIAL DEL ESTADO CENTRO DE SALUD DE TOCA,518575.0,
CCF055,CAJACOPI,820003684.0,EMPRESA SOCIAL DEL ESTADO CENTRO DE SALUD SIACHOQUE,40200.0,
CCF055,CAJACOPI,820003850.0,EMPRESA SOCIAL DEL ESTADO SANTIAGO DE TUNJA,70987777.0,
CCF055,CAJACOPI,820003876.0,E.S.E. CENTRO DE SALUD SANTO ECCEHOMO DE SUTAMARCHAN,151650.0,
CCF055,CAJACOPI,820005389.0,EMPRESA SOCIAL DEL ESTADO HOSPITAL REGIONAL DE CHIQUINQUIRA,144027325.0,
CCF055,CAJACOPI,822000327.0,COOPERATIVA DE UROLOGOS DEL META Y LA ORINOQUIA CUMO,23847013.0,
CCF055,CAJACOPI,822000946.0,MEDICINA NUCLEAR DIAGNOSTICA S.A.S.,9869816.0,
CCF055,CAJACOPI,822001570.0,HOSPITAL LOCAL PRIMER NIVEL E.S.E. FUENTE DE ORO,949970.0,
CCF055,CAJACOPI,822002459.0,EMPRESA SOCIAL DEL ESTADO DEL MUNICIPIO DE VILLAVICENCIO,302329134.0,
CCF055,CAJACOPI,822006595.0,"EMPRESA SOCIAL DEL ESTADO DEL DEPARTAMENTO DEL META ESE ""SOLUCION SALUD""",431045555.0,
CCF055,CAJACOPI,822007351.0,CENTRO OFTALMOLOGICO DEL LLANO S.A.,93620123.0,
CCF055,CAJACOPI,822007837.0,AMBULANCIAS DEL LLANO SAS,77039099.0,
CCF055,CAJACOPI,823001035.0,ESE CENTRO DE SALUD SAN JOSE I NIVEL SAN MARCOS,1128380.0,
CCF055,CAJACOPI,823002149.0,CENTRO DE SALUD SANTA LUCIA E.S.E.,1954618.0,
CCF055,CAJACOPI,823002227.0,INSTITUTO DE CANCEROLOGIA DE SUCRE S.A.S.,146009002.0,
CCF055,CAJACOPI,823002342.0,IPS CLINICA DE VARICES S.A.S.,79999995.0,
CCF055,CAJACOPI,823002991.0,CLINICA SALUD SOCIAL S.A.S,1015211.0,
CCF055,CAJACOPI,823003836.0,IPS SALUD A TU LADO SAS,2603040.0,
CCF055,CAJACOPI,823004710.0,IPS DE LA COSTA S.A,257824000.0,
CCF055,CAJACOPI,823004881.0,I.P.S. CLINICA GUARANDA SANA S.A.S.,56138917.0,
CCF055,CAJACOPI,824000204.0,ESE HOSPITAL MARINO ZULETA RAMIREZ,3397450.0,
CCF055,CAJACOPI,824000425.0,ESE HOSPITAL SAN JOSE,9338818.0,
CCF055,CAJACOPI,824000440.0,HOSPITAL HERNANDO QUINTERO BLANCO E.S.E,2895690.0,
CCF055,CAJACOPI,824000441.0,HOSPITAL LOCAL ALVARO RAMIREZ GONZALEZ E.S.E,18376482.0,
CCF055,CAJACOPI,824000442.0,ESE HOSPITAL SAN MARTIN,1473567.0,
CCF055,CAJACOPI,824000449.0,ESE HOSPITAL LOCAL DE RIO DE ORO,398031.0,
CCF055,CAJACOPI,824000450.0,HOSPITAL SAN JUAN BOSCO E.S.E,8986297.0,
CCF055,CAJACOPI,824000462.0,ESE HOSPITAL JOSE ANTONIO SOCARRAS,5469765.0,
CCF055,CAJACOPI,824000469.0,EMPRESA SOCIAL DEL ESTADO HOSPITAL EL SOCORRO,5005420.0,
CCF055,CAJACOPI,824000543.0,ESE HOSPITAL JORGE ISAAC RINCON TORRES,17830250.0,
CCF055,CAJACOPI,824000687.0,SOCIEDAD DE ONCOLOGIA Y HEMATOLOGIA DEL CESAR S.A.S.,260551777.0,
CCF055,CAJACOPI,824000785.0,ESE HOSPITAL LOCAL DE AGUACHICA,400000.0,
CCF055,CAJACOPI,824001041.0,CLINICA MEDICOS S.A.,1500000004.0,
CCF055,CAJACOPI,824002277.0,CLINICA BUENOS AIRES S.A:S,161154000.0,
CCF055,CAJACOPI,824004330.0,MEDICINA NUCLEAR SA,53606567.0,
CCF055,CAJACOPI,824005651.0,SALUD HUMANA EMPRESA S.A.S,9724800.0,
CCF055,CAJACOPI,824006480.0,IMAGEN RADIOLOGICA DIAGNOSTICA S.A.S,31547101.0,
CCF055,CAJACOPI,825001037.0,ESE HOSPITAL SANTA TERESA DE JESUS DE AVILA,1554665.0,
CCF055,CAJACOPI,825001119.0,ESE HOSPITAL DONALDO SAUL MORON MANJARREZ,3007643.0,
CCF055,CAJACOPI,825001800.0,CLINICA SOMEDA S.A.S,95988668.0,
CCF055,CAJACOPI,825003080.0,UNIDAD DE CUIDADOS INTENSIVOS RENACER LIMITADA,329229703.0,
CCF055,CAJACOPI,825003378.0,SAIS IPS SAS IMAGENOLOGIA Y HEMODINAMIA,42634630.0,
CCF055,CAJACOPI,825003685.0,URMEDICAS VIP S.A.S,150000012.0,
